,edit_history_tweet_ids,id,text
0,['1531649927578890242'],1531649927578890242,"Det siger en del om hvor svagt Enhedslisten reelt står i rød blok, når det ingen konsekvenser har, at Bødskov bevidst gemmer oplysninger for dem, som ville styrke Enhedslistens sag. #dkpol #dkmedier"
1,['1531226115087417345'],1531226115087417345,"Det her er skræmmende! Det er formanden for finansudvalget. Tænkt at have så ringe indsigt i basal økonomi. 

Ja, måske forstår han det godt, og derved bevidst manipulerer, og så bare satser på at hans vælgerne ikke forstår økonomi. 

Begge dele beskæmmende. #dkpol #dkmedier https://t.co/DYr7Jr2DIh"
2,['1531224066073534465'],1531224066073534465,"@Jens_Joel Jens, det er virkelig skræmmende at du er formand for finansudvalget, og har magt.. når du udviser så ringe indsigt i økonomi. Ja, der er selvfølgelig også muligheden at du bare forsøger at manipulere vælgerne, som du så håber ikke forstår det…"
3,['1530261121726390273'],1530261121726390273,"@lisnorgaard Ja, fakta kan være hårdt for folk, som ynder at leve i lala land.. LEV MED DET"
4,['1530236922920050688'],1530236922920050688,Så blev Regeringen igen sat på plads af EU. Gang på gang bukker regeringen og Folketinget hovedet og bare føjer de ordrer der kommer fra Bruxelles. #dkpol #dkmedier https://t.co/xaYhsmy9TN
5,['1529972421993848853'],1529972421993848853,@VithusDan @AnetteLyskjaer https://t.co/M7a2o8grvp
6,['1529970080271982598'],1529970080271982598,@lisnorgaard NB har kun én Facebook side. Den hedder nyeborgerlige
7,['1529969693301301258'],1529969693301301258,"@HermanMunk Nej, ikke bad… sæt dig ind i sagerne, hvis du vil deltage i debatten."
8,['1529907946381004804'],1529907946381004804,"EU blokerer den danske regeringens ønske om ny lov for sociale medier. Regeringen er defor tvunget til at trække sit lovforslag,  L146 tilbage. #dkpol #dkmedier"
9,['1529494440221585413'],1529494440221585413,"@BKonge Det er folk som dig, der vil hoppe i en hul med kviksand, hvis Mette Frederiksen sagde det.. tillykke med det.."
10,['1529485672628817931'],1529485672628817931,Det virker til at medierne intet har lært af deres forfejlede dækning af corona.. nu er det så bare abekobber der skal køres op.. #dkpol #dkmedier
11,['1528639547805925378'],1528639547805925378,9 ud af 10 indkomstgrupper har fået mindre under denne regering. Det er faktum..ligegyldigt hvor mange floskler statsministeren fyrer af. #dkpol #dkmedier
12,['1527658419733266432'],1527658419733266432,"Positivt at V, K og DF nu også har forladt de forhandlinger NB forlod sidste uge, da jeg kunne se hvor det bar hen.. så kan vi forhåbentligt få ryddet op efter et valg #dkpol #dkmedier"
13,['1526939506850553857'],1526939506850553857,@BKonge Gør jeg gerne.. vores politik er at man ikke indføre disse tåbelige regler… værsgo..
14,['1526928300265947137'],1526928300265947137,Måske årets tåbeligste forslag. Denne gang går det helt galt for Enhedslisten…Bilforhandlere skal nu tvinges til opfordre folk til at tage bussen og cyklen.…#dkpol #dkmedier https://t.co/1xNUB51sdE
15,['1525075230401744897'],1525075230401744897,"@frankeman25 Jo, når det kommer til gængse straffesager, så behøves den ikke være der…men det er en fornuftig beskyttelse mod at regeringen bare kan anklage folkevalgte.. og derved reelt fjerne folkestyret."
16,['1525074694344523777'],1525074694344523777,"@HenrikHusThrane Ja, det er regeringen som ikke vil have vi må vide noget… og så alligevel skal tage stilling.. det virker næsten som om de håber vi stemmer imod.."
17,['1524868675697885193'],1524868675697885193,"@BKonge Når loven er, at jeg skal træffe beslutning, så vil jeg selvfølgelig have et grundlag at gøre det på. Det bliver jeg nægtet af regeringen."
18,['1524864538390282257'],1524864538390282257,@mikaelege Altså.. sæt dig for pokker bare en anelse ind i sagen inden du plaprer løs….
19,['1524861244448161806'],1524861244448161806,@mikaelege Jeg har en bundet opgave. Jeg skal vurdere om immunitet skal ophæves. Dertil har jeg selvfølgelig brug for et vidensgrundlag. Det bliver jeg nægtet.
20,['1524759906242506752'],1524759906242506752,@PeterMa20502201 Læs min opdatering. Jeg vil ikke stemme for at ophæve før jeg kender baggrunden hertil. Det har intet at gøre med det du siger.
21,['1524718549079666689'],1524718549079666689,"Jeg kommer ikke til at hæve et folketingsmedlems immunitet uden at vide hvad det drejer sig om, fordi staten ønsker det. 
Det ville jo være vanvittigt! 
#dkpol #dkmedier"
22,['1524686052107202560'],1524686052107202560,"@SMSerup Statsfinansielt har det ikke stor betydning, da operationer begge steder bliver finansieret indenfor 2% budget. En mindre stigning dog. Men det vil utvivlsomt svække forsvarets muligheder for at bidrage til NATO, da budgettet nu skal strækkes over to alliancer og flere missioner"
23,['1524034264790089728'],1524034264790089728,"HER ER HVAD DER REELT SKER!
Et flertal i Folketinget har lige stemt ned, at der skal være folkeafstemning, hvis politikerne ønsker et fælles EU-forsvar…eller hvis politikerne ønsker at droppe retten til Veto på forsvarsområdet. #dkpol #dkmedier https://t.co/ABZSCEqup0"
24,['1523932609608400897'],1523932609608400897,"Det her er en skandale.. hvor er DR og TV2? Ifølge en rapport vil henholdvis kun 34 og 42 % af S og V’s vælgere ville stemme ja til at afskaffe forsvars- forbeholdet. 

Men 59 og 68% ville stemme for deltagelse i europæisk sikkerhed- og forsvars samarbejde. 

#dkpol #dkmedier"
25,['1522903138524672000'],1522903138524672000,"184 millioner står tandlægerne potentielt til at miste i indtægt grundet regeringens seneste påfund.. men Socialdemokratiet mener ikke det får betydning folks tandlægeregninger. 

Skræmmende at folk med så lidt basal økomisk forståelse leder landet. #dkpol #dkmedier"
26,['1521474813805608962'],1521474813805608962,"Det er sjovt med folkeafsteminger.. jo tættere datoen, des mere skingert bliver debatten og verden går nærmest under i følge politikerne, hvis man ikke stemmer som de vil… dagen efter holder politikerne fri.. og solen står op igen #dkpol #dkmedier"
27,['1520912473011986433'],1520912473011986433,"@KirstenNormann Så er det vel også et demokratisk problem at nogle partier får mere i støtte end andre, og derfor kan købe flere annoncer og andet… Jeg kan ikke se fornuften at skulle købe likes, for du mister jo muligheden for at målrette fx annoncer, da din taget Group er misvisende."
28,['1520822301855563776'],1520822301855563776,@lisnorgaard @KirstenNormann @dkpolparrot Det går faktisk ganske fint….
29,['1520822116484005891'],1520822116484005891,"@KirstenNormann Det vil da være tudetosset at købe likes, da det jo enten vil være falske profiler, bots eller nogen som kræver adgang til ens side. 

Hører af og til beskyldningen, da folk ikke kan forstå at jeg har det antal som følger min sider og liker. 

Men det handler nok mest om dem selv"
30,['1520735767999434752'],1520735767999434752,Regeringen går nu direkte til angreb på ytringsfriheden. Det er på tiden befolkningen siger stop for disse totalitære tiltag. #dkpol #dkmedier https://t.co/EA8XCfdVfR
31,['1520046785418477568'],1520046785418477568,"Først kaldte socialisten Carl Valentin Anders Holck Povlsen for en oligark. I går i Debatten på DR2 kaldte Pelle Dragsted så Elon Musk for en oligark. 

Det er befriende at disse typer slet ikke kan skjule deres sande jeg og deres åbenlyse foragt for succes. #dkpol #dkmedier"
32,['1518955156938887168'],1518955156938887168,@MrGullak Det der kan simpelthen ikke være sandt..Så dum findes ikke… og dog..
33,['1518844785683009536'],1518844785683009536,"Jeg kan forstå at Elon Musk’s køb af Twitter bekymrer David Trads, og Stine Bosse måske nu vil forsvinde fra platformen… ja..det der med ytringsfrihed og kunne blive modsagt…er også så ubehageligt. #dkpol #dkmedier"
34,['1518692019698348033'],1518692019698348033,Thank you Mr. Musk… please buy Facebook next… #dkpol #dkmedier
35,['1515964355732512768'],1515964355732512768,"@BorbergJakob @DavidTrads Nej, hvorfor skulle jeg det? Det vil heller ikke have noget med mig at gøre, at person skider på Biblen. men det er ikke det samme, som jeg ikke kan have en holdning til det. At man konstant skal tage afstand er sådan en identitets politisk opfindelse..den må de ligge og rode med"
36,['1515963205377478657'],1515963205377478657,"@ThorupSimon @DavidTrads Jo, der er noget helt galt i Sverige.. men der var også påsatte brænde i Danmark"
37,['1515962985864482818'],1515962985864482818,@EAgersnap @DavidTrads Nu vrøvler du bare.. At tage afstand er sådan en opfindelse fra den identitets politiske bølge.
38,['1515828195769073675'],1515828195769073675,"@DavidTrads Hvorfor pokker skulle jeg tage afstand fra det.. det har absolut intet med mig at gøre… jeg har intet behov for at rende rundt og tage afstand fra alt muligt, som jeg ikke er ansvarlig for."
39,['1515717484137140227'],1515717484137140227,@uffeelbaek @DavidTrads Hvad er så egentlig din holdning til at Sikandar render rundt og kalder stort set alle partier i Folketinget for racister…. Er det særligt dansk i din bog?
40,['1515716731196645382'],1515716731196645382,I følge @DavidTrads må man åbenbart ikke bruge ytringsfriheden til at provokere og sige noget dumt… gad vide om det betyder han fremadrettet vil censurere sig selv #dkpol #dkmedier
41,['1515448851192238081'],1515448851192238081,@marcus_stoltze @GudLarsen @MrMesserschmidt @AlexVanopslagh Hvordan finder man det..?
42,['1514543286039556099'],1514543286039556099,"@GudLarsen @marcus_stoltze @MrMesserschmidt @AlexVanopslagh Ja, jeg laver dem faktisk HELT selv de fleste..bare mig og en mobil… :-)"
43,['1512455626617729029'],1512455626617729029,"Samme partier, som tordner mod at der ikke er penge til skattelettelser.. har intet imod at give checks til folk..#dkpol #dkmedier"
44,['1511705702431170564'],1511705702431170564,@TroelsHansen6 Mit forslag er at politikerne stopper med at detailstyre folks tilværelse.
45,['1511641380749205507'],1511641380749205507,Så fik jeg svar på mit spørgsmål. Regeringen kan slet ikke gennemføre sit forslag om 2010 generation rygning grundet EU. Gad vide om nogle medier skriver om det? #dkpol #dkmwdier
46,['1509574460281552903'],1509574460281552903,"@olerasm @berlingske @NyeBorgerlige Præcis, og det er også hvad jeg siger, hvis du læser artiklen og ikke kun overskriften :-)"
47,['1505623799747784706'],1505623799747784706,"Jeg foreslår man stopper med at udbetale vederlag til regeringens ministre, indtil der bliver udbetalt hjælp til varmeregningen….Så må vi jo se om 6 måneder betyder noget for dem… #dkpol #dkmedier"
48,['1504573051899416579'],1504573051899416579,"Danmark kan potentielt vågne op til et helt nyt mareridt. En socialist som finansminister..Pia Olsen Dyhr! 
#dkpol #dkmedier"
49,['1504053636585996289'],1504053636585996289,"Jeg kan forstå at den AKUTTE varme hjælpepakke kommer på et tidspunkt i maj….!!!

Sjovt nok, så kunne samme partier sagtens hastebehandle restriktioner på folks tilværelser. #dkpol #dkmedier"
50,['1503834860166787072'],1503834860166787072,"Jeg har heldigvis svært ved at se regeringens tåbelige og formynderiske forbuds forslag blive stemt igennem. Alle blå partier er imod, og Enhedslisten vil have legaliseret cannabis.. og så kan man jo ikke samtidig gå ind for at forbyde salg af cigaretter.. #dkpol #dkmedier"
51,['1503664463504883715'],1503664463504883715,"@Larsskou @allaneu Hvis det foregår i det private og civile, så mener jeg ikke politikere skal blande sig. Jeg er tilhænger af at det ikke foregår fx i skoler og hospitaler."
52,['1503664115914620935'],1503664115914620935,@allaneu Sukker er også afhængighedsskabende..vil du forbyde dette også?
53,['1503663924968841218'],1503663924968841218,"@JunKorsholm Men at folk fortryder på et senere tidspunkt, er da intet argument for at fratage folk deres frie valg."
54,['1503663552854466561'],1503663552854466561,"@AfriCures Du er klar over at lovforslaget betød mindre logging og overvågning, ikk? Har godt set debatten på de sociale medier, men det er ret tydeligt at folk ikke har læst ca. 250 sider."
55,['1503653014183333891'],1503653014183333891,"Forbyd, forbyd, forbyd…Så er den socialdemokratiske forbudsregering på spil igen.. nu vil den forbyde rygning for kommende generationer.. 

Ingen grund til personlig ansvar, når Mor Mette nu bare kan bestemme det hele… 

Jeg er så træt af den her regering #dkpol #dkmedier"
56,['1502075689276747777'],1502075689276747777,@frankeman25 Åh gud.. du er en af dem… jeg føler med dig.. men hvis du virkelig gør en indsats.. så er jeg sikker på at du også kan få et meningsfyldt liv på et tidspunkt..
57,['1501881699994685440'],1501881699994685440,"Det store houdini nummer er nu i gang i dansk politik. Man bruger 18 milliarder årligt strukturelt, men man påstår at det ikke koster noget.. #dkpol #dkmedier"
58,['1500963738639376387'],1500963738639376387,@HjalteOlsen @pelledragsted Sikke en masse ord.. mine elever i 8. Klasse samfundsfag har dog mere viden om ideologier end dig.. Hjalte..
59,['1500610102071603201'],1500610102071603201,"@johnnymookmik @MichaelKrasnik @LoneWieberg @EstellThomsen @NyeBorgerlige Det var den gamle som var ulovlig. Folketinget kan ikke vedtage en ny lov, der vurderes ulovligt..længere er den ikke… den vurderes lovlig af justits..så kan EU protestere og sige nej.. men det gør den altså ikke ulovligt på nuværende tidspunkt.. det er fakta"
60,['1500593432271765506'],1500593432271765506,"@sorenpind Hvilke partier stod i perioden 2015-2019 i vejen for at man ikke træf beslutning og afsatte midlerne der? V, K, LA og DF taler alle nu om de 2%, men de havde jo flertallet dengang til bare at gøre det."
61,['1500590588604862465'],1500590588604862465,"@pelledragsted Det er faktisk 52 miliarder om året for at undgå den fattigdom, der kommer med kommunismen.. det er nærmest et røverkøb…"
62,['1500589340191338501'],1500589340191338501,"@nielsthdahl Ingen af de 4 partier, Venstre, kons, LA og DF har kunne fortælle hvem af dem der blokerede for at bruge 2% dengang de faktisk havde et flertal til at kunne træffe beslutningen.."
63,['1500577923224543244'],1500577923224543244,"Gad vide om det var Venstre, Konservative, LA eller Dansk Folkeparti, der ikke ville bruge 2% af BNP på forsvaret i perioden 2015-2019? De havde jo flertallet dengang. 
#dkpol #dkmedier"
64,['1499138569100742659'],1499138569100742659,@ACrazyConcept @MshakespeareK @Johnjohn1347 @DMCamilla @ulovliglogning @DMfagforening Nej
65,['1499138066442764289'],1499138066442764289,"@Porsmose Hun svarede faktisk helt præcis, og du kan se hvorledes vi gør i planen på vores hjemmeside. 

Og kunne aldrig drømme om at tage Pio Pio seriøs alligevel"
66,['1499137672429936643'],1499137672429936643,@DkHomecrafter Jeg har ikke læst dem endnu
67,['1499137466783125511'],1499137466783125511,@GitteKristense8 Absolut
68,['1499006428652134406'],1499006428652134406,"Man vil gerne have alle goderne, men man ikke er villig til at betale for dem.. Ja, det er jo en Enhedslisten Classic #dkpol #dkmedier https://t.co/d6s37fOO5T"
69,['1498721585879994370'],1498721585879994370,"@SoljaDalberg Når man ikke kan skelne mellem hypotetiske eksempler og en sammenligning, så burde man ikke deltage i den debat.."
70,['1498586406830104578'],1498586406830104578,"Kommunisterne i Enhedslisten er nu begyndt at skændes om hvor slem kommunister egentlig er.. priceless
#dkpol #dkmedier"
71,['1495759983207751694'],1495759983207751694,"Det er ret sigende for hvor forrykt hele Ny-feminisme bevægelse er blevet, når nogle politikere og organisationer kan slippe afsted med at anklage hele erhvervslivet for strukturel sexisme, som iøvrigt allerede er ulovligt #dkpol #dkmedier"
72,['1493209959638749184'],1493209959638749184,@paulkrugman This is a good example on why we have had so many unnecessary restrictions the last years.. uninformed fear…and by the way.. we are doing fine in Denmark..
73,['1490823763549724679'],1490823763549724679,@ClaesKnudsen Jeg er ikke tilhænger af statsstøtte til erhvervslivet.. den må du tage med socialisterne.. jeg VAR og ER tilhænger af at erhvervslivet bliver kompenseret for politikernes nedlukning af deres erhverv.
74,['1490762482335588355'],1490762482335588355,"Stop nu med den barnepige stat! 
Nu tales der så om at belønne folk med penge for at stoppe med at ryge..hvad bliver der næste.?? en tusse for ikke at gå på Mac Donalds.. 
#dkpol #dkmedier"
75,['1490762011327840260'],1490762011327840260,"@KristianMadsen Undskyld, det er godt nok noget vrøvl. Flertallet kunne da igangsætte med det samme, det vil de så ikke, da de insisterer på at finansieringen kun kan komme ét bestemt sted fra, som så er forligsbelagt..men det kan man da ikke bebrejde dem, som ikke er med i aftalen for."
76,['1487880314974318600'],1487880314974318600,"Den borgerlige opposition(V, K, NB og LA) fremsætter forslag om at afskaffe modregning straks. Enhedslisten støtter op. 
Hvis DF stemmer for, så er der flertal. #dkpol #dkmedier"
77,['1486458636440424460'],1486458636440424460,"@Jens_Joel Ej,.. Jens..ærligtalt.. nu bliver det pinligt fra jer. Sæt dig lige ind tingene.. jeg laver et opslag, hvor jeg takker alle dem som har støttet mig de sidste 2 år.. og det vælger du så at spinne til at jeg påstår at NB med 4 mandater har kunne bestemme det.. pinligt!"
78,['1486458102228660227'],1486458102228660227,"@minkonto Når du tager et screendumb fra min Facebook side uden at tagge mig, så er det mindste vel at man ikke lyver. 

Jeg takker alle der har støttet mig i de seneste 2 år.. altså, hvor dum er du lige, hvis du tror at NB med 4 mandater har kunne beslutte at ophæve dem.."
79,['1486337760529104897'],1486337760529104897,"Regeringen kunne uden problemer gennemføre fjernelsen af modregningen nu. 

Den eneste grund til at det ikke kan lade sig gøre er, at de kun vil finansiere det fra ét bestemt sted. Tag pengene fra råderummet eller finansloven og Wupti. #dkpol #dkmedier"
80,['1486279685176807424'],1486279685176807424,"I dag skal vi til møde om ophævelse af restriktioner. Én foruroligende sætning vil jeg har svar på.. det vil være forrykt, hvis det bliver tilladt at kræve corona pas visse private steder.. #dkpol #dkmedier https://t.co/ddQU7ZtS2M"
81,['1485567180091674624'],1485567180091674624,"@Designboks @Martin_Geertsen @sofiecn @AlexVanopslagh @PernilleVermund @PerLarsenC Tak, men nu har jeg faktisk kæmpet konstant for dette, selv da ingen andre gjorde det."
82,['1483208865864982530'],1483208865864982530,"@Thomas_Dahl Ellers tak, så ville jeg være lige som de andre politikere, bare med modsat fortegn. Jeg vil hellere opfordre folk til at tænke selv og træffe det valg de finder rigtigt for dem og deres kære."
83,['1482839612141752324'],1482839612141752324,@brian_konge At fjerne restriktioner er ikke det samme som at lade en smitte løbe løbsk.
84,['1482839181852385292'],1482839181852385292,"@Jens_engelbrech Ja, det har jeg gentagende nu siden februar påpeget. Lidt utroligt at først her 1 år senere, når det hele er på retur, at medierne vågner op.."
85,['1482838595362770954'],1482838595362770954,"@RabjergTonny Arbejdspladserne bliver i høj grad ramt, fordi der er håbløse isoleringskrav. Hvis du ikke er syg, så tag på arbejde,"
86,['1482797568161730564'],1482797568161730564,"DET HER ER EN FARCE! 59 indlagt på intensiv med corona! 59 ud af 5.830.000 danskere. Og Regeringen og dets støtterpartier fastholder nedlukning af hele brancher, massetestning og et ubrugeligt c-pas!
#dkpol #dkmedier"
87,['1481321987645526016'],1481321987645526016,@iNSiG9FiX At fjerne restriktioner er ikke det samme som at lade smitte læbe løbsk. Og vi mener stadig der skal være kontrol omkring sygehuse og plejehjem indtil disse myndigheder der mener de kan fjernes.
88,['1481320922271338500'],1481320922271338500,Regeringen skal stoppe deres skræmme kampagne om at der er nogle som vil lade smitte løbe løbsk. INGEN partier har udtalt eller mener det. Men vi er nogle som siger at man skal lytte til flere eksperter end Regeringens og forlade overforsigtighedsprincippet! #dkpol #dkmedier
89,['1481018623691005953'],1481018623691005953,"@allaneu Nej, det er ikke korrekt. Restriktionerne er hjelmet i bekendtgørelse, der som hovedregel kun gælder 4 uger i henhold til epidimiloven."
90,['1481013869195796485'],1481013869195796485,"@TheRealDkJan @RasmusJarlov @Heunicke @SSI_dk De gør præcis det, som regeringen beder dem om at gøre.."
91,['1481012917160099842'],1481012917160099842,"Lad os lige slå én ting fast. Restriktionerne udløber nu her. Det er kun hvis politikerne indfører nogle på ny, at de vil være der. Så kære medier,..stop nu med at hoppe på det spin med at lempe.. #dkpol #dkmedier"
92,['1480857334377160706'],1480857334377160706,@MMontclairre @RasmusJarlov @SorenPape @Blixt22 Det har jeg så faktisk også gjort tidligere i dag.. :-)
93,['1480620617405718533'],1480620617405718533,@AnneMarieMeyer @FlemmingSvenss1 Ja
94,['1480620338576871431'],1480620338576871431,"@Stig_Skov Det var straks, da de radikale jo havde udtrykt ønske om at de mente at højskolerne skulle åbne sammen med andre skoler Fx efterskoler.. så det tig direkte udgangspunkt i deres udmeldinger og intet andet"
95,['1480618776672575490'],1480618776672575490,"@MSkieller @SorenSchifter @radikale Nej, den er skam god nok. Det var epi møde her til eftermiddag hvor det var på"
96,['1480535500779835404'],1480535500779835404,For 4 dage siden ville De Radikale åbne højskolerne. Jeg fremsatte derfor et forslag om netop det. I dag stemte De Radikale så imod at åbne højskolerne. #dkpol #dkmedier
97,['1480146026984095747'],1480146026984095747,"@nikogrunfeld Næppe, jeg anviste faktisk fakta, men Detektor ville ikke bruge det. Men tillykke med at bruge tusind af borgernes skattekroner på en håndvask med en cigar.. :-)"
98,['1479866157230399492'],1479866157230399492,"@brianweichardt Men spørgsmålet er vel også mere om radikale vil støtte en S-SF regering? Det er jo en meget smart retorisk finte at hun kun fokuserer på én parti regering og ikke det, i min optik oplagte… nemlig S-SF"
99,['1479546842736209926'],1479546842736209926,"Lad os prøve et lille ekspert…
Alle dem som mener vi kan nøjes med vind- og sol energi uden at have teknologien til at lagre…… de får slukket deres strøm hver gang der ikke er nok det næste år. Så tager vi derefter debatten :-) #dkpol #dkmedier"
