,edit_history_tweet_ids,id,text
0,['1519999838884184069'],1519999838884184069,"Rekordhøj inflation, men @ecb undlader fortsat at hæve renten! #dkpol https://t.co/UYgJtCrrR6"
1,['1519954332359303175'],1519954332359303175,God analyse af statsministerens svingende humør og voldsomme vælgerløfter. Desværre varm luft det meste. Ledigheden er rekordlav og @regeringDK har stadig intet gjort for at få flere mellemøstlige indvandrere i job. Det er både dyrt og pinligt! #dkpol https://t.co/DbIJiDUtCV
2,['1519727398576693249'],1519727398576693249,Det her er jo en regulær tilståelsessag. Pinligt for regeringen! #dkpol #forsvarsforbeholdet https://t.co/oXqSWa924o
3,['1519652275492372480'],1519652275492372480,"Har netop modtaget denne fra Bulgarien. Det er ikke for sjov, når russerne lukker for gassen. Jeg er spændt på, om EU kan og vil hjælpe bulgarerne og polakkerne med gas-erstatninger. Ellers kan det da gå helt galt! #dkpol https://t.co/Tgkb93TeLu"
4,['1519607755610501122'],1519607755610501122,@PernilleRosen Det var da dagens gode nyhed! Swan Lee står bag en række uforglemmelige hits. Ser frem til at genhøre dem live🕺🏼
5,['1519316132422995971'],1519316132422995971,Hvor er det imponerende godt af @holgerrune2003. Vores nye tennisstjerne slog verdens nummer 3! Godt gået. 🎾 https://t.co/kvmCDBPtex
6,['1519299680085192706'],1519299680085192706,"Den høje inflation rammer især alm. danskere og andre med få penge hårdest. Kronen er låst til Eurozonen, der straks bør sætte renten op og få styr på inflationen. Og så må de sydeuropæiske lande i gang med at reformere deres skrantende økonomier! #dkpol https://t.co/DWOy9q8BPI"
7,['1519216379634888704'],1519216379634888704,"Dagens gode nyhed. God start af @regeringDK, men også vigtigt at få behandlet alle asylansøgninger i Rwanda eller lignende sted. #dkpol https://t.co/3H9iDi5SqP"
8,['1518948521940070400'],1518948521940070400,.@Twitter's ejerskift kan kun betyde mere ytringsfrihed – ja tak til det. Det har jeg sagt noget om til @tv2nyhederne. #dkpol https://t.co/AWmgfQme31
9,['1518877029193691136'],1518877029193691136,Jeg vil på det kraftigste opfordre @Tivoli til at gentænke sin afvikling af fredagsrock – eller alternativt risikere sit gode ry og rygte som en tryg og sikker forlystelsespark! #dkpol https://t.co/8RbqkcpiGr
10,['1518852294414151681'],1518852294414151681,"I @DanskDf1995 finder vi det dybt uhensigtsmæssigt, at @folketinget kan bevilge flere penge til politiet og fængslerne uden samtidig at øge bevillingerne til domstolene. Det må i sagens natur føre til store propper hos domstolene. Det bør ændres! #dkpol https://t.co/yWuvbBIsa3"
11,['1518697598156259329'],1518697598156259329,"Jeg håber det her bliver starten på en ny æra på de sociale medier, hvor ytringsfriheden igen sættes i højsædet! Tillykke til @elonmusk og @Twitter's demokratisk-sindede brugere. #dkpol https://t.co/gzv8CxphM6"
12,['1518630056964366336'],1518630056964366336,"Håber på, at et evt. opkøb af @Twitter fra @elonmusk's side vil føre til langt mindre censur, og – i det omfang grove og krænkende ytringer måtte føre til sanktioner – at de uddeles ligeligt til begge sider af det politiske spektrum! #dkpol https://t.co/IARFyrqyyx"
13,['1518573967833018369'],1518573967833018369,RT @VestegnsPoliti: Københavns Vestegns Politi søger vidner i en sag om voldtægtsforsøg i Brøndby #politidk https://t.co/7Y3shFdETS https:/…
14,['1518178330830417921'],1518178330830417921,"Det her dur ikke: “Kommuner må ikke hente en børneattest på borgere, der har ukrainske flygtninge boende. KL vil have nye regler.” Vil vi i @DanskDf1995 straks rejse sagen over for @regeringDK! #dkpol https://t.co/RPtryfdWBX"
15,['1517878080928419841'],1517878080928419841,"Vi kunne lære noget af det engelske retssystem, når det gælder dyremishandling! #dkpol https://t.co/WOhhyxhZr6"
16,['1517851927467507712'],1517851927467507712,Det her lyder som et potentielt yderst alvorligt brud på Ruslands-sanktionerne. #dkpol https://t.co/mzZ5VEpx7r
17,['1517428738882953216'],1517428738882953216,"Fantastisk vedtagelse, vi i @DanskDf1995 fik gennemført i dag sammen med et stort flertal i @folketinget. Nu skal vi det her bandeuvæsen til livs og for alvor have indført hårdere straffe, bandeforbud og konsekvente udvisninger af udenlandske bandemedlemmer! #dkpol #ftlive https://t.co/dIuibxpDXc"
18,['1517425725560795141'],1517425725560795141,https://t.co/iTM7SMsXaz
19,['1517415464858755074'],1517415464858755074,Debatten er også rejst af @venstre og @KonservativeDK
20,['1517408224730927104'],1517408224730927104,"I dag har vi i @DanskDf1995 indkaldt til debat i @folketinget om kriminelle bander, som vi ikke mener har nogen plads i et moderne demokratisk samfund. Forbud, udvisninger og lange straffe er vejen frem! #dkpol https://t.co/w4Kkbf3mdF"
21,['1516787341679116292'],1516787341679116292,Interview om kinesiske kameraer #dkpol https://t.co/xhEbsUQpVU
22,['1516781055927275520'],1516781055927275520,".@regeringDK's forslag om at forbyde danskerne at fyre med naturgas, der er den reneste af de fossile brændsler, er et udslag af ren panik. Lad os dog udbytte den danske naturgas fra Nordsøen, som komplementerer det danske energimiks perfekt! #dkpol https://t.co/FkJpdUzTM3"
23,['1516687067291566082'],1516687067291566082,RT @Pia_Kjaersgaard: Bum! Læs med👇 #stemnej #forsvarsforbeholdet
24,['1516502971747647500'],1516502971747647500,"Selvom jeg er AGF-fan, kan jeg ikke tage det mindste anstød af Prins Christians fodboldsympatier. Ham om det, men nu ved kongehuset i al fald, at fodbold og følelser er tæt forbundne.⚽️ https://t.co/mNMmZTSaj4"
25,['1516415235543945218'],1516415235543945218,"Det er åbenbart umuligt at integrere mange ikke-vestlige indvandrere – selv i 3. generation. Derfor skal vi, som @DanskDf1995 har foreslået, have en hjemrejselov, der fastsætter bindende måltal for hjemrejse af udlændinge. #dkpol https://t.co/IH9QKrTWW2"
26,['1516378101864931337'],1516378101864931337,"Jeg holder fast i, at det reelt er umuligt at skelne ml. politik og følelser og samtidig også kunstigt og uønskeligt. Mange politikere er åbenlyst drevet af følelser, når de ønsker at hjælpe de svageste og mest sårbare i samfundet. Det mener jeg stadig er fint og ædelt. #dkpol https://t.co/6MJS3R1E3b"
27,['1516376314042798090'],1516376314042798090,"Hvorfor lukke for det danske gasnet, når vi selv producerer gas i Nordsøen, og gassen virker som back-up energi, når solen skinner, og vinden ikke blæser? Det virker ærligt talt som en totalt forfejlet idé! #dkpol https://t.co/hd1UmFiwW7"
28,['1516079227338166277'],1516079227338166277,"Mand varetægtsfængslet for seksuel afpresning af mindreårig. Det er vigtigt, at vi sikrer, at seksualforbrydere og andre hårdkogte kriminelle altid varetægtsfængsles. #dkpol https://t.co/Ni0NjcZihH"
29,['1514504351791865859'],1514504351791865859,God påske til alle mine følgere og venner. Lad os nyde denne fantastiske kristne helligdag samt miniferie med vores venner og familie i fred og fordragelighed🙏 https://t.co/LUbFVqxTOu
30,['1513512524603396105'],1513512524603396105,Hvilken fantastisk nyhed! Det blev vi ikke populære på at foreslå i @DanskDf1995 i sin tid. Men i dag er det nu virkelighed! #dkpol https://t.co/NztqRw4o6N
31,['1513483231089369098'],1513483231089369098,Hvad sker der egentlig for @regeringDK? Som om den slet ikke tager danskernes naturlige skepsis over for mere EU alvorligt! #dkpol https://t.co/nm9pBXFaaY
32,['1513440694807023617'],1513440694807023617,"Helt enig med min formand her. Måtte danskerne først have afskaffet forsvarsforbeholdet, er det slut, men håber nu på, vi vinder den afstemning på nej-siden! #dkpol @MrMesserschmidt  https://t.co/iCEvMCs0D3"
33,['1513124681762721794'],1513124681762721794,"Jeg har i den forløbne uge haft den fagligt yderst store fornøjelse at besøge Retten på Frederiksberg sammen med FT-kollegaer. Her blev vi bl.a. klogere på, hvorfor retssager kan trække ud. En udfordring vi må have kigget på ASAP. #dkpol https://t.co/HtUK9FHSZ7"
34,['1513091388967108610'],1513091388967108610,"Hvis det er rigtigt, at stort set alle på Slotsholmen vidste, at der ikke var hjemmel til at aflive alle mink, må det jo samtidig betyde, at statsministeren med fuldt åbne øjne har begået et klokkeklart lovbrud! #dkpol 
#dkpol https://t.co/zYWrMXhdJQ"
35,['1512765440841469957'],1512765440841469957,Jeg har bestemt aldrig været nogen stor fan af det kommunistiske styre i Kina. Men det her er da voldsomt ubehageligt og vanvittigt! #dkpol https://t.co/kySAHWX7jJ
36,['1512699859974955008'],1512699859974955008,"Det her er bare dybt bekymrende, unødvendigt og yderst udansk: “Men det klinger ifølge flere borgerlige partier ekstremt hult, når Mette Frederiksens regering nærmest er gået »forbudsamok« med et hav af begrænsninger for danskerne.” #dkpol https://t.co/oY2Iso2lHn"
37,['1512483061509894149'],1512483061509894149,"Det her tempo er jo pinligt for EU, der med sin bureaukratiske tilgang ingen kriser løser:
Statsledere og regeringschefer fra de 27 EU-lande skal mødes til et særligt topmøde 30. og 31. maj. #dkpol https://t.co/Q3wm6NevZ9"
38,['1512141985460723713'],1512141985460723713,"Glimrende beslutning at ekskludere Rusland fra FN's Menneskerettighedsråd!
Men lande som Sudan, Somalia, Venezuela, Kina og Qatar sidder der altså stadig! Måske rådet bare skulle nedlægges? #dkpol https://t.co/Y1fMW5yx7m"
39,['1512134711396777992'],1512134711396777992,"Så fik jeg lov at besøge den taskforce, der undersøger den katastrofale brand på Scandinavian Star. De efterladte fortjener at få nogle bedre og klarere svar. #dkpol @MF_K_Lorentzen https://t.co/kMutBB1eZZ"
40,['1512130532896878606'],1512130532896878606,De 15 timer ugentligt var @regeringDK's forslag. Flere af os andre ville gerne have 15 timer i døgnet. Men lad os åbne aftalen igen og lægge flere timer til. 👍 (2/2) #dkpol
41,['1512130154126098435'],1512130154126098435,"Hold nu op justitsminister.😳 Det er jo direkte historieforfalskning at lade, som om du selv ønskede mere end 15 timers ugentligt åbningstid på nærpolitistationerne.🙄 (1/2) #dkpol https://t.co/iMknCdD42U"
42,['1512077828723929093'],1512077828723929093,"Dagens gode nyhed. Vi er i @DanskDf1995 tilfredse med, at stemmesedlen ændres. Nu bliver det tydeligt for danskerne, at der stemmes om EU-forsvarsforbeholdet! #dkpol https://t.co/ABPQ74TKEu"
43,['1512004682725613568'],1512004682725613568,"Det er vigtigere end nogensinde, at magthaverne beskytter de frie mediers ret til at arbejde uden risiko for censur og myndighedsindblanding! #dkpol https://t.co/OP7JhYPzQq"
44,['1511963623870144512'],1511963623870144512,".@regeringDK's passivitet og ligegyldighed overfor den menige danskers kvaler grundet den stigende inflation er dybt bekymrende. Få nu sænket afgifterne, @Spolitik! #dkpol https://t.co/azxl2P1k4Z"
45,['1511779638560837637'],1511779638560837637,"Det her ligner indledningen til en politisk spændingsroman, hvor en ledende embedsmand forsøger at slette alle spor bag sig ifm. med en historisk skandale! #dkpol https://t.co/LBasyOKTR1"
46,['1511770038226804737'],1511770038226804737,"EU er åbenbart i gang med at underminere vores nationale retspolitik, sikkerhed og politiets mulighed for at opklare forbrydelser. Ministeren må på banen og i et samråd klarlægge retstilstanden. #dkpol https://t.co/VHlbmxi4fO"
47,['1511694546673233920'],1511694546673233920,"Grotesk, at det overhovedet er en sag for EU, men måske en happy ending for @regeringDK i en yderst kikset sag. #dkpol https://t.co/BBj3OZZ7nl"
48,['1511652564219084802'],1511652564219084802,"Mener justitsministeren selv, at det her er tilfredsstillende!? #dkpol https://t.co/DXmHiwr6qS"
49,['1510905785806725121'],1510905785806725121,Bliver et nej fra @DanskDf1995 til at flytte ansvaret for kommende epidemiologiske restriktioner væk fra @folketinget. Det er et mærkeligt udemokratisk forslag fra @regeringDK! #dkpol https://t.co/c0YATx3kwU
50,['1510629091535376396'],1510629091535376396,"Fantastisk afgørelse. De hårde straffe virker. Og selvfølgelig skal de udvises. Det bedste var, at de også skulle afsone i deres hjemland. Dejlig dag for Danmark. 🇩🇰🇩🇰🇩🇰🇩🇰🇩🇰🇩🇰🇩🇰 #dkpol https://t.co/6n1VGF8a3X"
51,['1510599621978038279'],1510599621978038279,"Kære Trine. I @DanskDf1995 har vi fremsat forslag om nedsættelse af afgifter, mens de voldsomme prisstigninger raser. Det ignorerer @regeringDK og ønsker åbenbart, at de svageste danskere skal vælge ml. at spise eller at tænde for lyset og varmen! Kynisk. https://t.co/v6nTfkD8i1"
52,['1510156485447331843'],1510156485447331843,@AndersBksgaard Av!
53,['1509932568665333764'],1509932568665333764,@nicolai_kjaer Stort tillykke og velkommen til👍👍
54,['1509907631170859029'],1509907631170859029,"Stort tillykke og velkommen til @DanskDf1995 
Vært på Altinget-podcasten Danske Statsministre @nicolai_kjaer bliver ny sekretariats- og personalechef i Dansk Folkeparti. Han kommer fra et job som Senior Public Affairs Rådgiver i Danske Bank. #dkpol https://t.co/4Y31LVTlbA"
55,['1509901955967168561'],1509901955967168561,"Ja. Det action card var yderst problematisk og en bananrepublik værdigt! Regeringen har truffet beslutning om, at alle mink skal aflives! 😳 Folketinget er den lovgivende magt, regeringen er den udførende. Ren tilståelsessag! #dkpol 
https://t.co/Mh9A6zqvqo"
56,['1509880324746260480'],1509880324746260480,"Endnu en ny IT-katastrofe fra regeringens side! Denne gang, er det udstedelsen af våbentilladelser, der bliver forhindret af justitsministeriet/politiets nye IT-system. Justitsministeren kommer til at forklare sig i Folketinget! #dkpol https://t.co/xrfAAB6BgR"
57,['1509837865982779405'],1509837865982779405,Tillykke til @JThulesen med den ny rolle som tingssekretær. Det er du som skabt til. 😃 https://t.co/6enogOcRuI
58,['1509801748432662529'],1509801748432662529,Er det her seriøst eller en aprilsnar🤔 #dkpol https://t.co/Fltfb4mkQw
59,['1509623561123729416'],1509623561123729416,Det bliver et klart nej tak fra @DanskDf1995. Vi skal ikke have højere skatter til at finansiere nye flygtninge. Send i stedet de tidligere flygtninge hjem til deres oprindelseslande i Mellemøsten og omegn! #dkpol https://t.co/V7YFbahZHd
60,['1509585989081214982'],1509585989081214982,"Det her er dagens gode nyhed. Virkelig godt, at vores myndigheder kæmper med alt, hvad de har, for at få pengene fra udbyttesvindel hjem igen. Ros for det! #dkpol 👏 https://t.co/DD5n1gkST5"
61,['1509430199921819651'],1509430199921819651,"Lige så meget jeg glæder mig til Danmarks VM-lodtrækning, lige så lidt glæder jeg mig over, at @FIFAcom valgte at placere VM i Qatar… 🤦#dkmedier https://t.co/AKd1Zm6nsV"
62,['1509270641328934915'],1509270641328934915,"Det er dybt bekymrende og nærmest meningsløst, at @regeringDK ikke vil støtte de fynske politibetjente, der ønsker at bære sikkerhedsveste. Hvorfor ikke lytte til betjentene på gaden, @Spolitik!? #dkpol https://t.co/j9MKoi7OPX"
63,['1509163444888653836'],1509163444888653836,"Er helt paf over at justitsministeren ikke vil sikre de menige politibetjente mulighed for at bruge en sikkerhedsvest, hvis de føler sig utrygge. #dkpol #ftlive"
64,['1509158963769712640'],1509158963769712640,Det her er ganske enkelt skandaløst. @regeringDK vil gøre alt for at manipulere et ja til en EU-hær igennem! #dkpol https://t.co/PzhsO80Oxs
65,['1509128496362184719'],1509128496362184719,.@P1radio Debat om Tibetkommissionen og Kinas knægtelser af grundloven. #dkpol #ftlive @michaelaastrup @RosaLundEl https://t.co/KpyDCJvELV
66,['1509086886727454721'],1509086886727454721,"Hvorfor ikke sænke afgifterne til et niveau, så alle danskere kan betale deres el- og varmeregninger? Nu bliver checken blot udstedt til nogle tilfældige danskere, mens alle andre må lide videre. Ikke i orden! #dkpol https://t.co/KZZktxwLD1"
67,['1508803424455962637'],1508803424455962637,Det er virkelig positivt med fremskridt i fredsforhandlingerne mellem Rusland og Ukraine. Både ofrene for krigen – samt verdensøkonomien – har brug for fred! #dkpol https://t.co/XsLeI5gtXY
68,['1508786318150705152'],1508786318150705152,".@regeringDK har bevidst valgt at lade det kontroversielle udrejsecenter Kærshovedgård fortsætte i gode danskeres baghave. Hvorfor de udviste og kriminelle udlændinge ikke udsendes af landet, er mig en gåde. Kæmpe svigt af regeringen! #dkpol https://t.co/MxVCrWaZBP"
69,['1508763342416056321'],1508763342416056321,Fremragende tale af præsident @ZelenskyyUa. I @Danskdf1995 er vi klar til at intensivere presset på Rusland. #dkpol #ftlive https://t.co/mgriMUrPyR
70,['1508757252882194446'],1508757252882194446,Klar her i Landstingssalen for at høre præsident @ZelenskyyUa's tale. #dkpol #ftlive https://t.co/Jd86rkNtQN
71,['1508495455130431494'],1508495455130431494,"Det her er en virkelig vigtig dom. Terrorisme skal stoppes i planlægningsfasen, inden terroristerne når at blive helt konkrete og operationelle. Godt arbejde af politiet, efterretningstjenesten og domstolene! #dkpol https://t.co/NPv8cNM4Rp"
72,['1508405786678112260'],1508405786678112260,"Med Tibetkomm. står vi igen i den situation, at en kommission ikke får udleveret relevant materiale, fordi det slettes eller på anden måde bringes af vejen. Har forsøgt at få justitsministeren i tale for at få lovregler på området. Der skal handles. #dkpol https://t.co/ii6XqQIknJ"
73,['1508379850318520322'],1508379850318520322,"Modtaget Tibetkommissionens beretning, jeg er i gang med at nærlæse. Rystende, at Udenrigsministeriet har haft en generel kultur, hvor kinesiske hensyn blev sat over grundloven, og at dette var kendt af ledelsen. Mon ministrene har vidst noget?  #dkpol"
74,['1508044409841012739'],1508044409841012739,"Hvor er det skønt at se den gode @ChrisEriksen8 tilbage i landsholdstrøjen igen. Og hvor er det dog trist og afstumpet, at en hollandsk fan kaster mønter på ham. Pinligt! #dkmedier https://t.co/86drm46ycW"
75,['1508004179461218308'],1508004179461218308,Det her er virkelig usmageligt og upassende. Selvfølgelig bør en hustrumorder ikke kunne tjene på at myrde sin kone. Den sag vil vi forfølge! #dkpol https://t.co/Vz3YqcknSy
76,['1507692041983176704'],1507692041983176704,Det her ser bare ikke ordentligt ud. @regeringDK's ministre har et helt særligt ansvar for at passe på skatteydernes penge. Udenrigsministerens adfærd kalder på både kritik og ikke mindst omtanke! #dkpol @JeppeKofod https://t.co/D643lTZstr
77,['1507341166378901505'],1507341166378901505,"Forstår udmærket pensionisters vrede og afmagt, hvilket dog ikke berettiger nedsættende sprogbrug. Men @regeringDK's svigt ift. at sænke afgifterne på el og varme er fuldstændig uhørt! DF vil vedblive at minde @Spolitik om dette utilgivelige svigt! #dkpol https://t.co/ww7JahUtIZ"
78,['1507323490038390788'],1507323490038390788,"Tænk, hvis @regeringDK fulgte @DanskDf1995's forslag om at udvise alle udenlandske bandemedlemmer ved første dom! #dkpol https://t.co/QEFrwOnagq"
79,['1507296229243473921'],1507296229243473921,@ninapalesabonde For mig at se giver domstolene alt for korte straffe for voldtægt.
80,['1507103194660409351'],1507103194660409351,@DanskDf1995 #dkpol https://t.co/OffyD2jPPc
81,['1507066934944313357'],1507066934944313357,"Når det kan lade sig gøre for den tyske regering at nedsætte energiafgifterne til et minimum p.t. samt at udbetale varmehjælp til de svageste, hvorfor kan/vil det så ikke lade sig gøre for den @regeringDK? #dkpol https://t.co/EJM1yBJqpm"
82,['1507027550220001282'],1507027550220001282,Jeg er ærligt talt rasende over dette svigt fra domstolenes og myndighedernes side! Hvordan kan man lade sådan en livsfarlig vold- og voldtægtsforbryder gå frit rundt!? Det er ganske enkelt et utilgiveligt svigt fra myndighedernes side! #dkpol https://t.co/HWsDCwVjH5
83,['1506609755770470405'],1506609755770470405,Det her er jo et decideret rødt kort til @regeringDK's økonomiske politik fra danskernes side: “Den danske forbrugertillid er på det laveste niveau siden 2008.” #dkpol https://t.co/Egsa0dhm82
84,['1506298281873321994'],1506298281873321994,Respekt! 🚵‍♀️ https://t.co/4cqBOYGjvw
85,['1506278138988441603'],1506278138988441603,"Bekymrende sag. Selvindlysende, at en ambulance med blinket tændt under en alvorlig udrykning skal have lov til at køre over for rødt. Håber og tror på, domstolene kan se fornuften i dette. Ellers er @DanskDf1995 i al fald klar til at ændre lovgivningen! https://t.co/lUIWRCHSMv"
86,['1506273989110513664'],1506273989110513664,"Tyskland spiller en ret særegen rolle ift. Ruslands overfaldskrig på Ukraine. Vanskeligt at sige præcist hvorfor, men tyskernes energiafhængighed kunne være en faktor. Det siger også noget om, hvorfor EU's forsvarssamarbejde er en usikker størrelse! #dkpol https://t.co/7GCWbDb15p"
87,['1506211741922996229'],1506211741922996229,"Mener, at det må være på sin plads, at sundhedsministeren trækker sin fuldstændigt falske påstand om de danske unges drukvaner tilbage. Det her skaber helt unødig mistillid og politikerlede. Dementér nu, @Heunicke! #dkpol https://t.co/KGJ0dN74wC"
88,['1506175215981801483'],1506175215981801483,"Under dække af krigen i Ukraine, forklarede @regeringDK sine vælgere, at priserne nu stiger i form af en betydelig inflation. Det skyldes nu ikke alene Putin, men økonomisk uansvarlighed fra @Spolitik's side! #dkpol https://t.co/dgi96jZFbA"
89,['1506023379131904003'],1506023379131904003,"@camstampe @Heunicke Troede regeringen ville bekæmpe fake news, - ikke selv komme det, og bagefter ignorere enhver kritik af dens ugerning."
90,['1506022556624633863'],1506022556624633863,"RT @camstampe: Sundhedsminister @Heunicke ønsker fortsat ikke at svare på, hvorfor han siger, at akutmodtagelserne bliver oversvømmet med a…"
91,['1506003277741273098'],1506003277741273098,"Mine tanker og medfølelse går til ofrene for den uhyggelige og voldsomme skolevolds-forbrydelse, der har udspillet sig i Malmø idag. #dkpol #malmø #sverige 

https://t.co/hqYlSM432N"
92,['1505847928455323651'],1505847928455323651,"Godt at høre, at der forsøges at blive forhandlet fred i Ukraine. Og Israel som mediator er bestemt et godt bud! #dkpol https://t.co/7reu2UUoy2"
93,['1505834721351196672'],1505834721351196672,Tak til @QvortrupHenrik for at udstille @regeringDK's løftebrud ift. varmehjælpen! #dkpol https://t.co/8PtxEo0S7Q
94,['1505652162369667080'],1505652162369667080,"Hvor er han bare suveræn. Der er grund til at være stolt over suveræne @ViktorAxelsen, der nok er Danmarks bedste badmintonspiller gennem tiderne. Tillykke med titlen, Viktor!🏆 https://t.co/AFzm2E8SR2"
95,['1505567656493072391'],1505567656493072391,Det her er jo en kæmpe skandale: “Regeringen indkalder til forhandlinger om ny varmehjælp. Første check kommer først til august.” Hvad venter @regeringDK dog på!? #dkpol https://t.co/zCx7lb9KZ3
96,['1505555652558663680'],1505555652558663680,.@DanskDf1995 støtter ubetinget en granskning af @regeringDK's mystiske rolle og ageren i den politiske sag mod Claus Hjort Frederiksen. #dkpol https://t.co/7JEUaYT2HV
97,['1505177896809385986'],1505177896809385986,Det her er ærligt talt lidt pinligt for sundhedsministeren: “Hospitaler modsiger Heunicke-udtalelse om alkoholforgiftede unge: - Vi er på ingen måde oversvømmet.” #dkpol https://t.co/gmWl6SFWnt
98,['1504800835867488261'],1504800835867488261,"Lad os hjælpe @VestegnsPoliti med at finde denne angiveligt livsfarlige, kriminelle mand. Del gerne! #dkmedier 
https://t.co/iUgjJvAftd"
99,['1504485691052285958'],1504485691052285958,"@JanEJoergensen @soolu03 Ja men bandbullen retter sig vel i virkeligheden kun mod hans eget parti. Det er vel stort kun @spolitik der seriøst mener, at 17-årig nu ikke længere må købe en øl.."
