,edit_history_tweet_ids,id,text
96,['940816616706723843'],940816616706723843,It’s beginning to look a lot like Christmas 👏👏👏#dkpol@CNNPolitics https://t.co/eLdvFFUVcp
97,['940597013976178688'],940597013976178688,"Farcen fortsætter. Helt grotesk at statsminister Lars Løkke Rasmussen lover at regeringen stemmer for sin egen finanslov, mens Anders Samuelsen nægter at give samme løfte. Regeringen er i strid med sig selv #dkpol https://t.co/M6hwdpICVC"
98,['940317812068900864'],940317812068900864,"@john1966olsen Hej John,
Tak for interessen. Tror dog du skal kigge igen. Der er masser af internationale nyheder og journalister på listen😉"
99,['940313688866770944'],940313688866770944,Regeringskrisen når nye højder. Løkke lover samlet regering bag finanslov. LA vil ikke bakke op om Løkkes løfter. Statsministeren ligner Kaptajn Kaos fremfor en chef for en samlet regering #dkpol @Socialdemokratiet  https://t.co/WcauJxUK5a
