,edit_history_tweet_ids,id,text
0,['1511985687779856387'],1511985687779856387,"@MarianneVind Kære Marianne. Jeg synes, at du burde læse lovforslaget. Der er intet i det, der begrænser, hvor meget grønt flybrændstof selskaberne må bruge. Det er der heller intet i min betænkning, der gør: 

https://t.co/aLty7hEEOH"
1,['1482005678516576256'],1482005678516576256,"Ingen uenighed her. Ved ophævelse af forsvarsforbeholdet skal der følge penge med. Det mener Jakob Ellemann, og det mener jeg. Flere opgaver til forsvaret skal selvfølgelig finansieres.

https://t.co/Qu7YGn5Mv6"
2,['1468963896002109440'],1468963896002109440,"DSB trænger til at komme op i gear. Hvert år er der alt for mange forsinkelser og aflyste toge. Derfor bør togdriften yderligere privatiseres. Danskerne fortjener billige og hurtige toge, der kommer til tiden. #dkpol #dktrp https://t.co/iwqRkOyeiz"
3,['1461334959352950788'],1461334959352950788,"RT @indblik: “Vi er nødt til at se på atomkraft på en anden måde end for 30 år siden, hvor alle var forskrækkede”, lyder det fra Venstres E…"
4,['1458461421591830537'],1458461421591830537,Triste billeder vi ser med tusindvis af migranter gående på motorvejen mod den polske grænse. EU-Kommissionen svigter igen og igen kontrollen med den ydre grænse. Forstår godt at nogle lande føler sig tvunget til at handle selv og sætte hegn op. #dkpol https://t.co/iO7W0MZt8E
5,['1455142361483419665'],1455142361483419665,RT @Forsvarsmin: Søren Gade Jensen bliver ny kommitteret for @Hjemmevaernet https://t.co/unN2VJJtKs
6,['1451142208376217600'],1451142208376217600,"Atomenergi er grønt og burde føjes til EU’s liste over grønne energikilder. Der er brug for atomkraftværker, hvis vi skal energikrisen til livs og få sat en stopper for de tårnhøje elregninger, der lurer rundt om hjørnet. #dkpol #eudk #dkgreen https://t.co/bmV6yfBcgv"
7,['1448942966903541771'],1448942966903541771,Læs indlægget her: https://t.co/yo8RCEaR1V
8,['1448942851539210265'],1448942851539210265,"Øremærket barsel til mænd åbner for en ny sluse af velfærdsydelser, EU-borgere helt frit kan udnytte, som de har lyst til – ligesom med SU, SU-lån og dagpenge. Til fare for vores danske velfærdsmodel. Det skal stoppes nu! Danske velfærdsydelser tilhører danskerne. #dkpol #eudk https://t.co/jVBTRbPfai"
9,['1434472083715674112'],1434472083715674112,"RT @Ullegaard: Stor anerkendelse til de, der har gjort forskel for Danmark som udsendte til verdens brændpunkter. Glad ved at læse @JakobEl…"
10,['1387742893041979393'],1387742893041979393,"Skandale, at uddannelsesinstitutioner ødsler penge væk på at få flere udenlandske studerende til DK gennem agenter på skatteborgernes regning. De har ikke betalt for, at se vores velfærdsmodel blive udsultet af EU-borgere helt kvit og frit. #uddpol #dkpol https://t.co/prilqvhcOG"
11,['1382669076573659136'],1382669076573659136,"Antallet af spilreklamer er eksploderet. Til stor sorg for ludomaner og pårørende. Det bør stoppes omgående med et totalt forbud. Men det kræver, at mine gamle kollegaer i Folketinget simpelthen træder i karakter og får sat en stopper for galskaben. #dkpol https://t.co/YhtnzTnYGW"
12,['1374789419929108486'],1374789419929108486,"RT @Eibcouncil: We are pleased to announce Mr. @SoerenGade as the founding Chairman of @Eibcouncil 

Speaking at the high level Roundtable…"
13,['1370004952395964422'],1370004952395964422,@MarleneAmbo Tusind tak Marlene 👍
14,['1369968240588361728'],1369968240588361728,"@MarianneVind @madsfuglede @DKFISKPO Tusind tak, Marianne. Tak for opbakningen og støtten i denne sag. 👍"
15,['1369958959784812548'],1369958959784812548,Jeg er glad og stolt på fiskeriets vegne. EP sagde nej tak til tvungen kameraovervågning på alle fiskefartøjer. Og et ja tak til ikke at straffe fiskerne for urimelige regler om fangster. #eudk #dkfisk #dkpol https://t.co/CqBmTztKSi
16,['1369725860480229377'],1369725860480229377,"Vigtig sejr for danske fiskere! EP har stemt mit forslag igennem, som er første skridt til, at fiskerne kan overholde reglerne for logbogen, når de bliver kontrolleret på havet. Godt for danske fiskere, der får mindre bøvl og mere tillid til at passe deres job. #dkpol @DKFISKPO"
17,['1367439070171983880'],1367439070171983880,"Vi redder ikke klimaet ved at presse landbruget til at flytte sin produktion ud af DK. I stedet flyttes klimaproblemerne over grænsen. Vi skal kæmpe for, at DK fortsat vil være et landbrugsland. Ellers mister vi eksport og arbejdspladser. #dkpol #dkgreen https://t.co/xYkKLRNTo6"
18,['1367029639823130624'],1367029639823130624,"RT @SvendErikAnder7: Manglende adgang til norsk farvand sætter danske fiskere under pres, og det koster dyrt i landdistrikterne. Tak til @S…"
19,['1357389400368418816'],1357389400368418816,@noa_redington Der har været et lille pip fra vesterhavshytten..
20,['1354327391674511362'],1354327391674511362,"I dag er det international mindedag for Holocaust og dets ofre. Et mørk og dystert kapitel, vi aldrig må glemme. Vi skal gøre alt for, at historien ikke gentager sig. Særligt i en tid med stigende antisemitisme. #dkpol #eudk https://t.co/wfWbHEb2cp"
21,['1352258796341628935'],1352258796341628935,"Det er på tide, at regeringen og Folketinget stopper erhvervslivets styrtblødende sår. Mange menneskers levebrød er på spil. Ikke ok, at de ikke får den kompensation, de var stillet i udsigt. Husk på de er rygraden i vores samfund og økonomi. #dkpol #dkbiz https://t.co/gfTWaFK4OH"
22,['1350017143337865217'],1350017143337865217,"Mange virksomheder har lidt større tab under krisen end det, de kan få i kompensation gennem hjælpepakker. Der skal ryddes op! Læs mere i @LarsSandahlS og min kronik her. 👇 #dkpol https://t.co/D7mn7Id6kS"
23,['1349294291525500928'],1349294291525500928,"Det var en god nyhed, der kom i går! For Den Europæiske Menneskerettighedsdomstol fastslog nemlig, at Højesterets udvisning af bandelederen Shuaib Khan var helt på sin plads. 👍 #dkpol https://t.co/R0RpJlIlmB"
24,['1347939202441342977'],1347939202441342977,@KaagaardOskar @venstredk Præcis min pointe. 👍
25,['1347171447261847553'],1347171447261847553,"EU har været for sløve og for nærige med at indkøbe corona-vacciner. Milliarder af kroner er brugt under krisen på at redde vores lande, men EU vælger at spare på mirakelkuren, der kan hjælpe os ud af krisen, fordi den er for dyr? Come on... #dkpol #eudk https://t.co/XOobVRbZ0E"
26,['1342431334661312513'],1342431334661312513,"RT @tvmidtvest: Søren Gade er alt andet end tilfreds med den nye brexit, der rammer fiskeriet hårdt.
https://t.co/Z8doxvIrjz #dkpol"
27,['1339553190778384384'],1339553190778384384,"Folketinget burde give danske ludomaner og deres familier en tidlig julegave. Et totalt forbud mod spilreklamer. Hvis vi ønsker færre ludomaner i fremtiden, burde vi starte dér. For ludomanernes, familiernes og samfundets skyld. Det ville klæde os. #dkpol https://t.co/tJutdtNbCv"
28,['1329449458728374278'],1329449458728374278,"Når EP snart skal stemme om det syvårige budget, stemmer jeg ikke for. Støtter ikke fælles gæld, nye skatter, højere budget, svag prioritering af den ydre grænse og mere føderalisme. Skal kunne se mig selv i øjnene og være tro mod mine ord. #dkpol #eudk  https://t.co/XR2WnZNJU4"
29,['1324335039967039492'],1324335039967039492,"Efter den seneste tids terror er det på høje tid, at EU kommer ind i kampen og sikrer europæerne mod udefrakommende fare. Derfor nytter det ikke noget, at EU gang på gang nedprioriterer den ydre grænse. Den skal styrkes og lukkes nu. #dkpol #eudk https://t.co/pHvnZpr96w"
30,['1322096627381903361'],1322096627381903361,"Konflikten mellem Tyrkiet og Frankrig handler ikke om Islam-bashing. Det handler om at stå vagt om vores livsform og ytringsfrihed, som onde kræfter vil til livs. EU bør give Tyrkiet tilbage af samme skuffe med boykot af tyrkiske varer. #dkpol #eudk https://t.co/D8Z71skXdX"
31,['1321367192441622528'],1321367192441622528,"@PHummelgaard @Venstre @JanEJoergensen Hvilket mine kollegaer i delegationen også mener. Det fremgår i denne artikel, hvor @Loekkegaard_MEP udtrykker samme skepsis: https://t.co/t62hoBdqCw"
32,['1321365945550540800'],1321365945550540800,"@PHummelgaard @Venstre @JanEJoergensen Jeg gentager blot det, jeg hele tiden har ment og stadig mener. Nej tak til en fælles europæisk mindsteløn, vi skal passe på den danske model."
33,['1321359944969523200'],1321359944969523200,"@MarianneVind @JanEJoergensen @venstredk Hej Marianne, har her til morges diskuteret det med mine tre kollegaer i delegationen, vi er enige om, at vi skal passe på den danske model."
34,['1321358058979807232'],1321358058979807232,"Jeg er stor modstander af en fællles europæisk mindsteløn, som EU-kommissionen foreslår. Det vil fuldstændig smadre vores danske model. Så lad mig slå fast, Venstre ser på forslaget med stor skepsis. #dkpol #eudk https://t.co/Fh8rnoQRNd"
35,['1319248075299430401'],1319248075299430401,"Vi skal stoppe, at EU-borgere kan komme til DK og frit tage for sig af vores velfærdsydelser. Derfor foreslår jeg et opsparingsprincip på sociale ydelser, hvor man skal have boet i DK i minimum 3 år før man fx kan få gratis uddannelse, SU osv. #dkpol #eudk https://t.co/daiGXnbXz0"
36,['1314171510047768579'],1314171510047768579,"Samfundet skal ikke acceptere, at bilister, der kører med hovedet under armen, hensynsløst smadrer andres liv. Straffen for vanvidskørsel skal op nu! #dkpol https://t.co/Oq2sXhy158"
37,['1310990237666029572'],1310990237666029572,@IndEmbassyBru @Mahatma150 We will never forget his contribution. He is a true inspiration for many people and still is - not only in India but around the World. 👍
38,['1309096442997493761'],1309096442997493761,"EU svigter endnu en gang de ydre grænser i nyt asyludspil. Jeg tror ikke, at de problemer, vi har, med tilstrømningen af illegale migranter stopper, før vi får lukket EU’s ydre grænse. #dkpol #eudk https://t.co/oGEpmTy5E6"
39,['1304064518209900544'],1304064518209900544,"Alle, der tjener vores land i uniform, skal kunne få PTSD-hjælp. I dag har vi en veteranpolitik med mange tilbud til PTSD-hjælp. Men tilsvarende har fx politi-, fængselsbetjente, sundhedspersonale ikke samme mulighed for hjælp. Det skal de have! #dkpol https://t.co/i7d7W8BVFs"
40,['1293866741878206469'],1293866741878206469,"Det er tankeløst, når flere hundrede samles til fx en muslimsk begravelse eller til fest netop nu i denne corona-tid. Vi er alle nødt til at vise hensyn, så landet ikke skal lukkes ned igen. Og undskyld mig, det er jo ikke forbudt at tænke sig om. #dkpol https://t.co/jUJAS23OwV"
41,['1290548480503689217'],1290548480503689217,Lyt gerne med 👍 #dkpol https://t.co/4QpA0UVZjM
42,['1288817756167708673'],1288817756167708673,"Det er ikke politiets ansvar, at visse indvandrermiljøer har mistillid til politiet. Det ligger hos dem selv. Politiet er ikke herre over, at nogle i DK med uret ser politiet som et symbol på ondskab, mens vi andre ser det som et symbol på tryghed. #dkpol https://t.co/JcUIay1Tw8"
43,['1286581312250351616'],1286581312250351616,"Med budgetforliget har EU neddroslet ambitionerne om at sikre kontrol med den ydre grænse. Jeg har altid ment, at EU’s grænsebevogtning skal oprustes her og nu. Med budgetaftalen må vi vente 7 år før grænsekorpset er på plads. Det er et svigt. #eudk #dkpol https://t.co/iidZ2Vwalj"
44,['1285263407466393609'],1285263407466393609,"RT @ThomasFunding: Tour de Bondrøv er nået til tredje omgang. Denne gang med @SoerenGade, der serverer kolde jægerøl og gode historier. @ka…"
45,['1283759208505253890'],1283759208505253890,"Appels skattefinte i Irland skal stoppes. Slet ikke i orden, at multinationale selskaber ikke betaler den skat, de skal. Det skaber uretfærdig konkurrence og skader danske virksomheder. Kalder på en fælles bund under selskabsskatten i EU. #dkpol #eudk https://t.co/6G5fV6vpif"
46,['1283713027678916608'],1283713027678916608,RT @m_anneberg: Lobbylands ultimative EU-battle er sparket i gang - live fra Hellerup med ⁦@SoerenGade⁩ og ⁦@mortenhelveg⁩ som dyster mod d…
47,['1283417348939145217'],1283417348939145217,"Helt urimeligt med en skatteprocent på 0,005 for store selskaber. Derfor behov for fælles bund under selskabsskatten i EU. #eudk #dkpol https://t.co/QF9sA22ILI"
48,['1277517121581395968'],1277517121581395968,"Gode takter fra Kasper Hjulmand. Ludomani er anerkendt som en lidelse på linje med alkoholisme. Ønsker vi færre ludomaner i fremtiden, bør vi starte med at forbyde spil- og bettingreklamer. #dkpol https://t.co/a3fWU256k4"
49,['1276138050180059137'],1276138050180059137,"Ja, vi skal passe på miljøet og sortere affald. Men hvad med de ældre, der har svært ved at overkomme at sortere i en skov af affaldsspande? Hvem skal hjælpe dem? Hjemmehjælperen skal vel ikke bruge tid på affald og droppe andre opgaver? #dkpol #dkgreen https://t.co/YzDQakBgbA"
50,['1272753416448679937'],1272753416448679937,"RT @JakobEllemann: Statsministerens taktik har isoleret DK, og regeringen beder i dag Folketinget om lov til at acceptere et højere EU-budg…"
51,['1271054784083214336'],1271054784083214336,"Der burde ikke være undtagelser for telefonsalg. Burde være et aktivt tilvalg, hvis man gerne vil ringes op og sælges til. Mange ældre kan ikke sige nej til ivrige telefonsælgere og ender med at få en dummebøde. @aeldresagen &amp; FT bør tage kampen op. #dkpol https://t.co/wiBLaLQOAp"
52,['1268510494182309895'],1268510494182309895,"Glad for opgør med kviklån. De skyhøje renter er at sidestille med rockerlån. Nok får man ikke klippet fingrene af, hvis man ikke betaler. Men fremtiden bliver taget fra dig. Så gerne, man gik længere. Men for nu et vigtigt skridt på vejen. #dkpol #dkbiz  https://t.co/OtCu2tL9SY"
53,['1265963624721526784'],1265963624721526784,"Vi skal selvfølgelig hjælpe hinanden landene imellem. Men vi skal ikke være til grin for egne penge og sende en gratis check til EU. Det er ikke rimeligt, at danskerne skal bøde og betale for Sydeuropas gældsproblemer. Det er ikke solidaritet. #dkpol #eudk https://t.co/64c3pJWXmI"
54,['1264539752306532355'],1264539752306532355,"Svært at forstå forargelsen over, hvad der sker i Gentofte og Københavns Kommune. Det sker hundredevis af gange om året i mange af landets kommuner. I årevis har alle været ligeglade - burde været stoppet for længst. #dkpol https://t.co/okTXyZZGcB"
55,['1263133442948182018'],1263133442948182018,"Danmark burde følge England som eksempel i forhold til organdonation med formodet samtykke. I Danmark er der for få donorer. Proceduren skal vendes om, så man automatisk er donor fra det 18. år – medmindre man selv melder fra. Det vil redde liv. #dkpol #sundpol"
56,['1260909417849069569'],1260909417849069569,"@kimthedanish Jeg er sådan set enig. Det er slet ikke i orden, at en mor med to børn på Islands Brygge kan få en bøde for at gøre et kort hvil, når de 30 til fællesbøn ingen bøde får."
57,['1260904750012399616'],1260904750012399616,"Det var respektløst, da over 30 muslimer i søndags samlede sig til bøn ved Gellerupparken. Uanset om man er muslim eller kristen, og uanset om man bor i Gellerupparken eller i en fynsk landsby, gælder der de samme regler. De kan ikke gradbøjes! #dkpol https://t.co/3WcBz8irjg"
58,['1257618847269609472'],1257618847269609472,"Det er ikke en ændring af sommerhusreglen, den står jeg 100% bag. Det handler om at give kommunerne og borgerforeningen mulighed for at sælge en flexbolig til udenlandske statsborgere. Det er ikke et retskrav for udlændinge, men en mulighed for kommunerne."
59,['1257618206560268295'],1257618206560268295,"Vi skal holde hånden under vores landsbyer. Jeg foreslår, at der åbnes op for at sælge tomme helårshuse til fx tyskere og nordmænd. Så undgår vi faldefærdige huse. Hjælper den ældre, der ikke kan sælge og giver beskæftigelse til lokale håndværkere. #dkpol https://t.co/o9DRV632pS"
60,['1255864579885871106'],1255864579885871106,"@AlexReventlov @MissMaryFischer Kæmpe tillykke, Alexander 👍🤓"
61,['1255859391183630343'],1255859391183630343,"Utallige fodboldkampe er blevet aflyst som følge af corona-krisen. Det betyder færre bettingreklamer i flimmerkassen. Det har en effekt. Færre spilafhængige søger hjælp. Viser tydeligt, at vi skal have indført et forbud mod spilreklamer nu #dkpol @ludomani https://t.co/3SEvhdAaoP"
62,['1251168444491366401'],1251168444491366401,@MogensJensenS @DKFISKPO Tak for et rigtig godt samarbejde! 👍
63,['1251167856827473920'],1251167856827473920,Jeg takker mange gange for samarbejdet @MogensJensenS 👍 https://t.co/VhmR25FdXP
64,['1251110298486013952'],1251110298486013952,"Har i dag stemt nej til EU’s samlede genopretningsplan. Ikke fordi jeg ikke ønsker, at vi skal hjælpe andre lande. Men fordi jeg er imod mere føderalisme med bl.a. højere EU-budget og mere magt til EU. #dkpol #eudk
 https://t.co/zlVLTE2fxa"
65,['1250766142953717762'],1250766142953717762,"Vi skal hjælpe de andre EU-lande, der er i knæ. Men forslag som at hæfte solidarisk gennem euro-obligatoner og flere penge til EU-budgettet er helt uspiseligt. Danskerne skal ikke betale en rød reje ekstra til EU's budget. #dkpol #eudk #COVID19 https://t.co/6BgTIxg7GW"
66,['1250721141339181056'],1250721141339181056,Stort tillykke med fødselsdagen og de 80 år til Hendes Majestæt Dronning Margrethe. Det har været en ære at tjene Hendes Majestæt og vort land. Jeg er stor beundrer af Dronningens store engagement i stort og småt. 🇩🇰 #dkpol https://t.co/fpd3s6GXzV
67,['1245988228898926592'],1245988228898926592,RT @RenewEurope: #Covid19 also has a great impact on Europe's fishing sector. Good step forward that the @EU_Commission has taken on board…
68,['1245721088052604930'],1245721088052604930,"Vores sygehuse skal ikke harmoniseres på tværs af grænserne. EU skal ikke have beføjelser til at lukke lande ned. Det er og bliver en national kompetence. Og det er og bliver dk politikere, som skal stå til ansvar over for dk vælgere. #dkpol #eudk #COVID19 https://t.co/6Br7PamN2p"
69,['1244651110146740224'],1244651110146740224,"RT @RenewEurope: #Covid19 is affecting the maritime sector, putting the continuation of transportation of essential goods, such as food or…"
70,['1240637510830764032'],1240637510830764032,"Vi skal sikre, at vores samfund er robust nok til at stå en ny virus-krise igennem. Der bør derfor nedsættes en beredskabskommission, der kulegraver erfaringerne fra corona. Vi skal have oprettet et nødberedskab, der står klar til, når krisen rammer #dkpol https://t.co/qfutiPfwWI"
71,['1237756563143745537'],1237756563143745537,"Målet om 70% CO2-reduktion må ikke betyde, at udledning af klimagasser flyttes ud af DK. Det gør os fattigere. Vi skal række regeringen hånden, hvis ikke støttepartierne er klar til at nedjustere klimamålet, hvis det viser sig umuligt at nå #dkpol #dkklima https://t.co/bzUdnYgeNI"
72,['1235589471078420480'],1235589471078420480,"Vi skal beskytte vores unge mennesker mod afstumpet vold i nattelivet. En del af løsningen kunne være markant øget overvågning med ansigtsgenkendelse på offentlige steder. #dkpol #eudk
 https://t.co/s5HkfwKjqw"
73,['1233794328000114688'],1233794328000114688,"Som jeg hele tiden har sagt: Der er behov for at få EU’s grænsevagter på plads nu, ikke om flere år. Især så længe vi er afhængige af Tyrkiets præsident Erdogan og flygtninge stadig strømmer mod EU. #dkpol #eudk https://t.co/YJ7dCSXGmx"
74,['1230414388781355010'],1230414388781355010,RT @DKFISKPO: Tillykke til @SoerenGade med posten som koordinator for den politiske gruppe @RenewEurope  i Fiskeriudvalget. Godt med en stæ…
75,['1228253452448550914'],1228253452448550914,"@Kira_MPH 2) Derfor synes jeg, at der er behov for værn mod de stigende udgifter til SU til udenlandske studerende. Det er sådan set også en del af SU-reformen fra 2013, som blev vedtaget, da SF sad i regering."
76,['1228253427572101121'],1228253427572101121,"@Kira_MPH 1) Jeg mener bestemt ikke, at udenlandske studerende er en byrde. Men jeg mener heller ikke, at man efter få timers arbejde i Danmark, skal have lige adgang til danske velfærdsydelser."
77,['1227576891286138881'],1227576891286138881,"EU mener, at omskæring af piger og kvinder kun er et spørgsmål om ligestilling mellem køn - ikke et spørgsmål om kultur og religion. Fejlagtigt, mener jeg. For selvfølgelig handler pigeomskæring også om kultur og religion. #dkpol #eudk
 https://t.co/v6CmkK1p1m"
78,['1225797929165869057'],1225797929165869057,"Antallet af udenlandske studerende, der får SU i Danmark, stiger år for år. Dansk SU er blevet et tag selv-bord. Det må stoppe. Vores velfærdsmodel kan ikke holde til, at alle EU-borgere får adgang til danske velfærdsydelser. #dkpol #eudk #uddpol
 https://t.co/HTGvlddyNY"
79,['1224736365515902977'],1224736365515902977,"Hvis EU fremover vil spille en rolle som global sikkerhedsmagt, så er der behov for at sige klart fra overfor regimer, som truer vestens sikkerhed. Ellers kan vi godt glemme alt om at blive taget seriøst af bl.a. USA og Storbritannien #eudk #dkpol https://t.co/8JkMvkDiuG"
80,['1221788772247003136'],1221788772247003136,@karmel80 Tak Karen!
81,['1217820514711937024'],1217820514711937024,"Der er behov for nye asylregler i EU. Ellers risikerer vi, at strømmen af asylansøgere til Europa fortsætter. Spørgsmålet er dog, om det er den rette EU-kommissær, som er blevet sat i spidsen for det arbejde. Det har jeg skrevet lidt om her: #eudk #dkpol https://t.co/fZ40vjUNIU"
82,['1215280335249866752'],1215280335249866752,"GPDR-reglerne kan være fornuftige nok, men i stedet har vi fået en regeljungle, der spænder ben for frivillige foreninger og erhvervsdrivende. Det er bare ikke godt nok. Reglerne skal laves om, så vi får bugt med de gakkede EU-regler. #dkpol #eudk #gdpr https://t.co/91HYOWViYO"
83,['1214280877070520321'],1214280877070520321,RT @BennyEngelbrech: Det er lykkedes at få en vejpakke igennem der skal skabe ordnede forhold på de europæiske veje. Vi er nået dertil genn…
84,['1210543796490047488'],1210543796490047488,"Vi skal passe på Danmark og danskerne. Det nytter ikke noget, at vi er et af de EU-lande, der bruger færrest midler på politi og sikkerhed. Der er behov for flere ressourcer til vores fantastiske politi. Tryghed må vi aldrig tage for givet. #dkpol
 https://t.co/QL32TqO8jf"
85,['1208319847630876672'],1208319847630876672,"TV 2 burde undskylde for deres skræmmekampagne mod HPV-vaccinen efter ingen studier, som i INGEN kan finde sammenhæng mellem vaccinen og de symptomer, som vaccinen blev mistænkt for at give. #dkpol #sundpol #dkmedier https://t.co/WY4Z6nWxid"
86,['1206849337181065216'],1206849337181065216,"Glad for at @mfMorten vil have et opgør med spillebranchen og deres reklamer for pengespil. Men vejen frem er ikke at skære ned i antallet af spilreklamer. Vejen frem er et totalt forbud, hvis vi ønsker færre ludomaner i fremtiden. #dkpol https://t.co/fD1RqKM4P0"
87,['1205125046802505729'],1205125046802505729,"Kælling, klovn, smatso - det risikerer man at blive kaldt, hvis man vover at mene noget på de sociale medier. Stop det nu bare, kan man ikke sige noget pænt om andre, skal man holde sin mund. Behandl andre, som du selv ønsker at blive behandlet. #dkpol https://t.co/MTHx2imspk"
88,['1200406779408113670'],1200406779408113670,"RT @DTUtweet: Besøg i dag af MEP @SoerenGade, som fik indblik i DTU Aquas arbejde med monitering af #fiskeri, fiskebestande + forskningsbas…"
89,['1200337063230525440'],1200337063230525440,"Vanvittigt, hvordan borgerne er blevet ført bag lyset med løgne i sagen om en 170 km lang højspændingslinje i Vestjylland. De folkevalgte bør give borgerne garanti på, at kablerne ender i jorden, uanset om beslutningen bliver udskudt eller ej. #dkpol
 https://t.co/nGLvqtseoN"
90,['1197064902130712576'],1197064902130712576,"Fri bevægelighed og det indre marked gavner DK og skaber vækst og velstand. Men EU skal ikke være en social union. Derfor er det ikke rimeligt, når EU-borgere efter kort ophold får samme rettigheder til danske velfærdsydelser som danskerne #eudk #dkpol https://t.co/ZYxRNKp8cU"
91,['1195002804919787522'],1195002804919787522,"Danske jøder skal ikke se sig over skulderen og leve i utryghed i Danmark. Desværre lever antisemitismen i bedste velgående. Det hører ingen steder hjemme. Vi burde indføre en international kippadag, hvor vi står sammen i Europa mod antisemitisme. #dkpol https://t.co/askJMxsdFB"
92,['1194168823840202752'],1194168823840202752,RT @NielsFuglsang: Jeg er enig med @SoerenGade: Fiskeriet skal med i Brexit aftale. Det står vi vestjyder helt fast på! https://t.co/1xG5p8…
93,['1192019967048343552'],1192019967048343552,"Når en EU-finansieret tyrkisk rapport udpeger Inger Støjberg, som en ”central spiller i et islamofobisk netværk”, så er ord som tåbelig og vanvittig ikke længere dækkende. Jeg fatter ikke, vi finder os i, at borgernes penge misbruges på den måde #dkpol 
https://t.co/mUuZ2OVQuX"
94,['1191651478294929408'],1191651478294929408,"Ros til @simonkollerup for at tage problemerne omkring kviklån alvorligt. Vi skal beskytte folk mod skrupelløse lånehajer. Fx med reklameforbud for kviklån, renteloft og kreditvurdering af låneren. #dkpol #kviklån #dkbiz https://t.co/IZv1AF2uzg"
95,['1189947805781110784'],1189947805781110784,"Der mangler organdonorer i Danmark. Alt for mange står på venteliste til et nyt organ og for mange dør, mens de venter. Derfor skal proceduren vendes om: vi skal være fødte organdonorer - med mulighed for fravalg. #dkpol #sundpol 
 https://t.co/UyPbkckBl4"
