,edit_history_tweet_ids,id,text
0,['1511443951680737282'],1511443951680737282,"@NielsFuglsang @Christian_Goth @Enhedslisten Gider du lige at redegøre for EU traktaten artikel 42, stk 2? Hvad betyder det der “fælles forsvar”?"
1,['1511443661451628552'],1511443661451628552,"Er der ikke en eller anden derude, som jeg fortælle @MogensJensenS , at EU og Europa ikke er det samme? Lidt ligesom zone 2 og zone 3 også er to forskellige ting… https://t.co/u5qlzw0oN8"
2,['1511443248425971717'],1511443248425971717,"Jeg synes ikke rigtig, jeg har set alting @AltingetEU dele noget her på det seneste. Det kan vel ikke mangle på inspiration? Ellers hjælper vi gerne. #HvadBlevDerAfGuy https://t.co/nEEjIUqqBh"
3,['1511442905331904518'],1511442905331904518,"@NielsFuglsang @AltingetEU @dkmedier Er det derfor, du så gerne komme til mine fester..? #partyon"
4,['1511441757451476997'],1511441757451476997,"@j_esmann Beklager, hvis det går for hurtigt for dig. Det er en reference til valgloven. Send gerne pm en anden gang, så folk ikke tror, du ikke forstår sammenhængen #vilgernehjælpe"
5,['1511441191639961602'],1511441191639961602,"@mnorgaard Næsten synd, ingen har reageret på dit opslag. Så nu gør jeg det. Hvad får mit tweet til at ligne Orban..?"
6,['1511440894880358402'],1511440894880358402,"@snsdk Hvad var det, der ikke var klædeligt? Mit ønske om at bede @JakobEllemann formidle sig til den energipolitiske virkelighed..?"
7,['1511440500166901766'],1511440500166901766,"@m_reippuert @Berry1952K @SikandaSIDDIQUE @PernilleVermund @Spolitik God tilgang. Og sørg for, at de skriver dem selv..!"
8,['1511440347569737747'],1511440347569737747,@clauskamp @AltingetEU @dkmedier Aner ikke hvem manden er.
9,['1511440224823488516'],1511440224823488516,@Berry1952K @data02 @SikandaSIDDIQUE @PernilleVermund Og som forfatter til ramadan-sang hele to år i træk… 🤔
10,['1511439940835545094'],1511439940835545094,@Obitz90 Tak - nu fattede jeg det!!!
11,['1511439301745254402'],1511439301745254402,"@TroelsHansen6 @hansersej Så hvis alle ved, det er en løgn - er det Ok at lyve..? #vildtsynspunkt"
12,['1511438960886693895'],1511438960886693895,"@ChristinaEgelun Jeg er ked af at gå op demokratiet som styreform, @ChristinaEgelun Ved, det må være svært at kapere. Men jeg troede, det var det, ukrainerne lige nu gik i døden for."
13,['1511438532904169480'],1511438532904169480,"@denbertuz @ChristinaEgelun Af formulere et spørgsmål ledende kan da ikke retfærdiggøres af, at folk “nok” kan gennemskue løgnen…"
14,['1511438190586081280'],1511438190586081280,"@MKP74140859 @Broccolidwarf @ChristinaEgelun Men er det centralt? Det væsentlige er da, at ophavsgiveren har pligt til at udtrykke sig præcist"
15,['1511437792294981633'],1511437792294981633,@Broccolidwarf @MKP74140859 @ChristinaEgelun Det synspunkt åbner gigantiske muligheder for fremtidig manipulation..!! Håber ikke @Statsmin følger din profil
16,['1511437541949513732'],1511437541949513732,"@Hapsdog @EnuSDk @data02 @Berry1952K @SikandaSIDDIQUE @PernilleVermund Tak for de gode ord. Men synes, vi skal tale pænt om hinanden."
17,['1511437247312244737'],1511437247312244737,"@JensKSimonsen @ChristinaEgelun De, der planlægger efter, at folk ikke har læst den før, burde ikke være ved magten."
18,['1511437093528035330'],1511437093528035330,@Ilovecolaz @ChristinaEgelun Enig.
19,['1511436917744840715'],1511436917744840715,"@r4tionalsk3ptic @ChristinaEgelun Grotesk, at vi kom dertil, at eu partierne bruger semantik frem for retorik"
20,['1511436515313868805'],1511436515313868805,"@m_abs @ChristinaEgelun Præcis. At folk godt ved, hvad sagen angår, retfærdiggør ikke, at man forsøger at vildlede"
21,['1511436380794232839'],1511436380794232839,@m_abs @BosseStine @ChristinaEgelun Jeg for at vise storsind nok til at være demokrat 😅
22,['1511435972948467717'],1511435972948467717,@JonSigge @ChristinaEgelun Good point
23,['1511379959926992896'],1511379959926992896,"Så er der da eet af EU- partierne, der har ægte demokratiske sindelag. Tak, @PiaOlsen #fairafstemning #dkpol #eudk https://t.co/EgGsyQnnWR"
24,['1511360645039599622'],1511360645039599622,"Mere Nato - mindre EU

https://t.co/ba2gTc6OZx"
25,['1511098871929352193'],1511098871929352193,@RiaEU @AltingetEU @dkmedier Men sjovt nok kun EU-kritiske. Jeg glæder mig til at se lidt om @SchaldemoseMEP @NielsFuglsang @mortenhelveg @MargreteAuken @vestager og deres skøre venner. God skrivelyst. Er sikker på @KofodPeter gerne bistår med info 😉
26,['1511097983798231044'],1511097983798231044,"@BosseStine @Nigel_Farage @EuropaBev @politiken @berlingske @DRNyheder Hvordan har du det med, at dine venner i Ungarn er allieret med jobbik..? Er du så fascist - eller bare dobbeltmoralsk..? Apropos United for Hungary. https://t.co/XoqXXWIFN0"
27,['1511095337460588545'],1511095337460588545,@LarsLoecke @AltingetEU @dkmedier https://t.co/iloImmJTvf
28,['1511093729880330247'],1511093729880330247,@jakobnielsen @AltingetEU @dkmedier I starter bare med @guyverhofstadt her og eu-hær vs national hær. Det vil være fint lige at få koblet op på @radikale og @venstredk #tak https://t.co/2Aa3Kd9xjk
29,['1511066532423610376'],1511066532423610376,"Kære @AltingetEU - jeg går ud fra, vi er enige om, at I fremover bringer alle skøre meldinger fra mepere med angivelse af dk-gruppe, ikke..? Bekræft gerne offentlig, så alle i @dkmedier ved, hvor I er. #dkpol https://t.co/Hch4fEimdU"
30,['1510625579913166853'],1510625579913166853,"RT @sebdor: Det er nok bare mig, der er tungnem, men når Ja-siden nu er så fuldkommen sikker på at ingen danskere er usikre på, hvad vi ste…"
31,['1510598510458163205'],1510598510458163205,@BjarkeMoeller @BosseStine @FlemmingMoller @Unite123456 @JohnStahlschmid @pelledragsted @EuropaBev Det er ikke overdragelse af suverænitet at afskaffe vetoretten. Dermed kan det ske igen - og igen uden folkeafstemning. Enig..?
32,['1510598233973792769'],1510598233973792769,@madshyldahl @PLautrupLarsen @michaelaastrup Jo det gør. For 1/4 af EUs medlemslande er ikke med i Nato
33,['1510598096530595847'],1510598096530595847,"@Cspr_Hedegaard @PLautrupLarsen NATO ikke har interesser..? Hvis vi gerne vil ind i Sahel, kan det da bare vedtages i NATO uden amerikanere eller andre, der ikke vil med. Det er intet krav for en Nato-operation, at alle lande bidrager."
34,['1510597692736819201'],1510597692736819201,"@MogensJensenS @Kildegaardens USA vil gerne, at Europa leverer mere. Det vil jeg også. Men da ikke gennem eu. Det skal være gennem Nato, så vi også har briterne med."
35,['1510571135414542336'],1510571135414542336,"@EuropaBev @BosseStine @FlemmingMoller @Unite123456 @JohnStahlschmid @pelledragsted Og vil du også bekræfte, at ændringer fra enstemmighed til flertal ikke kræver folkeafstemning? Ligesom med Lissabontraktaten, der fjernede enstemmighed/vetoret på 19 områder – uden folkeafstemning https://t.co/g03zLHL65q"
36,['1510566220629786627'],1510566220629786627,"@FinnBreddam @PLautrupLarsen Men vel at mærke en vetoret, der gang på gang er blevet afskaffet – uden folkeafstemning..! https://t.co/epqymXhRtI"
37,['1510565919818489856'],1510565919818489856,"@Cspr_Hedegaard @PLautrupLarsen Vi skal leve op til vores Nato forpligtelse. Minimum 2 % af BNP! Men det skal ske indenfor Nato. Man kan jo sagtens lave Nato-operationer uden amerikanerne deltager militært. Men vil være katastrofalt ikke at have dem med i forhold til efterretninger, diplomati og koordinering"
38,['1510564627226275843'],1510564627226275843,"@BosseStine @FlemmingMoller @Unite123456 @JohnStahlschmid @pelledragsted @EuropaBev Soupstone? Det ved jeg slet ikke, hvad betyder. Men jeg ved, hvad det vil betyde for Danmarks sikkerhed, hvis man opbygger et selvstændigt eu-militær, som vil splitte Nato..! Europa har brug for amerikanerne – ikke nødvendigvis militært, men på efterretninger og meget mere."
39,['1510563170401890307'],1510563170401890307,@BjarkeMoeller @PLautrupLarsen Eller EU’s egen udenrigsminister... https://t.co/F8B02FkVYQ
40,['1510562850384879619'],1510562850384879619,"@BjarkeMoeller @PLautrupLarsen Nå, men så tager vi bare Macron https://t.co/o8e7GQsqkc"
41,['1510562251190804481'],1510562251190804481,@ZebWatz @PLautrupLarsen Prøv igen https://t.co/xtnhm3kGhC
42,['1510562057510436875'],1510562057510436875,"@FinnBreddam @PLautrupLarsen Prøv at holde argumenterne fra 2000 ved euro-afstemningen op mod, hvad euroen er endt med at blive i dag. Synes du stadig, vi taler om syner?"
43,['1510561746771226630'],1510561746771226630,"@madshyldahl @PLautrupLarsen @michaelaastrup Der er nok større sandsynlighed for, at EU falder fra hinanden end at Nato gør det. Og hvorfor skulle europæerne ikke kunne have større militært engagement indenfor Nato? Tænk eksempelvis på Nato-operationerne i Bosnien. Der kom amerikanerne først militært med til sidst"
44,['1510561204137336834'],1510561204137336834,"@BosseStine @FlemmingMoller @Unite123456 @JohnStahlschmid @pelledragsted @EuropaBev Du får lige oversigten her. Det er alle de områder, Lissabontraktaten afskaffede vetoretten. Det skete som bekendt uden folkeafstemning. Kilden er i øvrigt regeringens lovforslag, bilag 3 #dkpol #eudk https://t.co/BR4ze3Fwhi"
45,['1510560115816079363'],1510560115816079363,"@PLautrupLarsen @michaelaastrup Det vil være aldeles sagligt. Flere traktater har jo flyttet rundt på tingene og ændret stemmeprocedurer uden folkeafstemninger. Så det er nu, man skal beslutte sig – uanset hvordan samarbejdet fremad måtte se ud"
46,['1510535496254078978'],1510535496254078978,"@BosseStine @pelledragsted @EuropaBev Øh - altså den vetoret, Lissabontraktaten afviklede på 19 områder - uden afstemning, hvor befolkningen blev spurgt..?!"
47,['1510535315487866880'],1510535315487866880,"@BosseStine @JohnStahlschmid @pelledragsted @EuropaBev Så nu føler du dig også udfordret af, at @PLautrupLarsen og jeg sludrer om ret faglige ting, @BosseStine ..? 🤔"
48,['1510531124463915010'],1510531124463915010,"@PLautrupLarsen Tag blot euroen. De fleste vil nok indrømme, at det i dag er noget helt andet end vi fik fortalt i over 2000, da vi blev spurgt."
49,['1510530944691806211'],1510530944691806211,"@PLautrupLarsen Pointen er, at vi ikke aner, om de forbliver mellemstatsligt. Det kan man ændre i EU uden at spørge befolkningerne. Med andre ord aner vi ikke, hvad det er, vi siger ja til. Du har vist fulgt debatten længe nok til at se, at EU pludselig er noget ganske andet end man forventede"
50,['1510530605540421641'],1510530605540421641,"@TomTomKrus @Kildegaardens Nej, Danmark har brug for stærke alliancer. EU er ikke en militært stærk alliance. Der har vi brug for både briterne og amerikanerne. Derfor skal vi naturligvis ikke være med i et projekt, der skiller dem fra os"
51,['1510530362128183303'],1510530362128183303,@Unite123456 @FlemmingMoller @JohnStahlschmid @pelledragsted @BosseStine @EuropaBev Danmarks sikkerhed ligger i Nato! En selvstændig eu-militær kommandostruktur vi naturligvis dele Nato. Allerede fordi en fjerdedel af EU’s lande ikke er med i nato. Det er med sikkerhed ikke i hverken danskernes eller europæernes interesse
52,['1510530025707433985'],1510530025707433985,"@JohnStahlschmid @pelledragsted @BosseStine @EuropaBev Så du mener ikke, at det er relevant i et demokrati at diskutere, hvordan magthaverne manipulerer med vælgerne? Det vil både Putin og Orban da være enig med dig i…"
53,['1510529803241283585'],1510529803241283585,"@pelledragsted @BosseStine @EuropaBev Præcis! Er det egentlig almindeligt, at selve ordlyden på en stemmeseddel også er undergivet politisk forhandling? Rammerne er jo fastlagt i loven...som i øvrigt ikke er fulgt her"
54,['1510529511540023298'],1510529511540023298,"@FlemmingMoller @Unite123456 @JohnStahlschmid @pelledragsted @BosseStine @EuropaBev Hvordan giver det mening at sige ja til noget, men i bedste fald ikke ved, hvad ender med at være?"
55,['1510529202872852484'],1510529202872852484,"@TomTomKrus @Kildegaardens Og det er super! Selvfølgelig skal vi europæere løfte mere i Europa. Men det kan aldrig blive et argument for, at det skal ske i EU. Vi har stadig brug for koordinering med USA - også selvom de sætter deres tropper andre steder på kloden"
56,['1510528824508923905'],1510528824508923905,@pro_dialog_ @LRisgaard @tv2newsdk @hansersej Det håber jeg! Derfor skal @LRisgaard naturligvis også forsvare sit synspunkt. Jeg rydder kalenderen
57,['1510528641368797187'],1510528641368797187,"@JensKSimonsen @Kildegaardens Fint nok. Det gør I bare. Med min erfaring i forhold til EU-systemet, vil det sikkert stå klar omkring 2050. Indtil da er det nok meget godt, vi har Nato"
58,['1510528329602023424'],1510528329602023424,"@PLautrupLarsen Men så skal du huske, at man med Lissabontraktaten – uden folkeafstemning – afskaffede vetoretten på 19 områder. Så dette er eneste gang, vi bliver spurgt. Med mindre vi takker pænt nej."
59,['1510526935612284931'],1510526935612284931,"@PLautrupLarsen Så er det rart med Stoltenberg hos os. Men du er vel enig i, at vi altid efter et nej kan vælge at tage en ny afstemning – mens vi aldrig nogensinde efter at ja vil kunne få forbeholdet igen?"
60,['1510522089366867973'],1510522089366867973,".@LRisgaard Hej Lizette. Du har ikke svaret på min opfordring endnu. I stedet for bare hovedløst at bede dine medlemmer stemme ja til mere EU, så stil op til åben debat med mig og fremlæg dine argumenter..! Er sikker på, at @tv2newsdk og @hansersej gerne bistår #dkpol #dkmedier"
61,['1510521461018173445'],1510521461018173445,"@PLautrupLarsen Selvfølgelig skal Europa tage større ansvar. Men hvem beder om, ar EU gør det? Det skal selvsagt ske indenfor NATO - ikke i EU, hvor knap 1/4 ikke er medlem af NATO"
62,['1510521242767568896'],1510521242767568896,"@PLautrupLarsen Vidste ikke, vi havde bevisbyrden, Peter. Men NATOs generalsekretær siger det ret klart… En eu-hær med egen kommandostruktur osv vil naturligvis spille NATO og dermed svække vores sikkerhed #dkpol #mereNATO #mindreEU https://t.co/WExtqWirDY"
63,['1510520533246484481'],1510520533246484481,"Håber, at eu-partierne læser @Kildegaardens spændende artikel i dag - og især forstår, at den militære alliance med USA ikke bare handler om materiel - men også diplomati og efterretninger. Derfor er NATO så vigtig, og et eu-militær så forkert..! #dkpol #MereNATO #mindreEU https://t.co/2hEhRGTFpv"
64,['1510360693605912576'],1510360693605912576,"RT @TClausen_: Mette Frederiksen afviser blankt i JP, at hun eller ja-siden har været  involveret i formulering af stemmesedlen til d. 1 ju…"
65,['1510360564350001158'],1510360564350001158,"RT @TClausen_: Mon ikke ja-partierne har siddet og kigget på denne her graf, da de sammen blev enige om, hvad formuleringen skulle være på…"
66,['1510157703678734339'],1510157703678734339,.@AnderssonMikkel er en af de mest læseværdige stemmer på den borgerlige fløj - og hans kamp for et nej 1.Juno er bestemt ingen undtagelse… #dkpol https://t.co/ETmvFjiezh
67,['1509769235840520217'],1509769235840520217,1.april… 😂 #paspåderude https://t.co/gK9Q7fbGgz
68,['1509574847050965005'],1509574847050965005,Og nu giver eksperter os også ret..! #eufup #dkpol https://t.co/mf2tcccu0f
69,['1509537605792239624'],1509537605792239624,@MoScheelsbeck Vildt forslag..!
70,['1509511431019978760'],1509511431019978760,"Jeg har indbragt regeringen for Ombudsmanden for at vildlede befolkningen. Den stemmeseddel, man har foreslået til 1.juni, er helt uacceptabel og lever ikke op til de krav, lovgivningen stiller..! #dkpol https://t.co/lztBegre67"
71,['1509141147326853128'],1509141147326853128,"@BenjaminElberth Det er mere luft end der tilsyneladende er i regeringens budget til folk, der er ramt af høje varmeregninger… #Salen"
72,['1509140891340099595'],1509140891340099595,Hvordan kan man holde folkeafstemning om EU-forsvarsforbeholdet uden at nævne hverken “EU” eller “forbehold” på stemmesedlen..? 😳😳😳 Det er da grotesk #newspeak #eudk #dkpol https://t.co/ayTTPDhYYl
73,['1509050910605025283'],1509050910605025283,".@JeppeKofod skal sådan set ikke have utak for at sige det rent ud – han vil gerne have danske tropper med i militære aktioner under EU flag! Så ved vi ligesom, hvad vi stemmer nej til 1. juni... #dkpol https://t.co/L3htqYtlF8"
74,['1508349533759102979'],1508349533759102979,"Statens overskud - 57.800.000.000kr
Men alligevel ingen varmehjælp til pensionister eller andre. Det er en SKANDALE 😡 https://t.co/gV6XvSpUb1"
75,['1508347408119476225'],1508347408119476225,RT @AliSufiDK: Fresh Prince of Bel-Air https://t.co/310VWtJsDV
76,['1508347200941789185'],1508347200941789185,"#MereNATO #MindreMacron

https://t.co/OflQRFdYN8 https://t.co/7xVBNQ9FK1"
77,['1508153170505125898'],1508153170505125898,"Er der lige nogen, der minder os om, hvorfor Danmark skulle gå med i EUs forsvarssamarbejde, når vi har NATO med amerikanerne…? #Macron 🙄 #dkpol https://t.co/OflQRFdYN8"
78,['1508027000459509760'],1508027000459509760,"2/2 Ja, faktisk langt mere trist end det, der præger DF, hvor vi i fælles flok er ved at skabe version 2,0. Ekstra Bladet skal ikke glæde sig for tidligt - deres håb om DFs deroute har ingen gang på jord #GodSøndag https://t.co/Y0D7vShM72"
79,['1508026866174681090'],1508026866174681090,"Anonyme kilder er åbenbart nu fast bestanddel af EBs journalistik. Jeg troede ellers, at det presseetisk hørte til undtagelsen at bruge folk, der ikke tør stå på mål for deres ord? Trist udvikling! 1/2"
80,['1507989785083846660'],1507989785083846660,"Endnu en ikke-folkevalgt eu-bureaukrat med mere magt end den samlede danske regering. Skudsmålet er, at “han meget gerne vil være i rampelyset, men samtidig er en elendig kommunikator”. Putin må juble..! #dkpol @altinget  https://t.co/oSrWDFPs6M"
81,['1507711361748553729'],1507711361748553729,"Er du lidt af geni på some og mere end almindeligt nysgerrig på politik? Så kunne dette være noget for dig… #dfversion2 #dkmedier #some 
 
https://t.co/YHmpHu3xoE"
82,['1507692255905202176'],1507692255905202176,"Der er et kæmpe paradoks, som ja-partierne skylder at give en forklaring på inden 1. juni - nemlig den at intet i NATO-samarbejdet forhindrer, at europæiske lande kan lave operationer alene (fx uden USA). Så hvorfor skal europæisk oppudsning ske i EU? #dkpol https://t.co/lJ4o24xbXF"
83,['1507313760918200357'],1507313760918200357,Jeg byder @LRisgaard op til debat – helt uden forbehold #eu #debat @FH_dk2019 #dkmedier #dkpol https://t.co/MtgOgd1Axo
84,['1507266683970502658'],1507266683970502658,Something is rotten in the state of EU… #MereDK #MindreEU #dkpol https://t.co/W6WnMl7znz
85,['1507078306222514183'],1507078306222514183,Varmehjælp skal udbetales nu - ikke til august..! #dkpol  https://t.co/oUi8Isy3ZI
86,['1507016410471362571'],1507016410471362571,Vi må jo leve i Absurdistan… 🙄 #dkpol https://t.co/M6GqLOl8Nh
87,['1506886065680007171'],1506886065680007171,Trist som EU og Putin konkurrerer om at nedlukke modstanderens medier… https://t.co/iThyLy4iFj
88,['1506522642546937859'],1506522642546937859,I 2018 lovede @Spolitik at sætte en stopper for donationer fra en stribe stater. Nu er det reduceret til eet navn..! #VælgerFup https://t.co/dnBe6JU7rJ https://t.co/9OLpyAEL3U
89,['1506263296504127489'],1506263296504127489,@BertilFruelund @cordua_jarl Når man er vokset op med Lademann… https://t.co/l9MsK4nRk9
90,['1506262774187446281'],1506262774187446281,@cordua_jarl Macron..? https://t.co/T741C6eUyU
91,['1506261405145739267'],1506261405145739267,"@cordua_jarl Nej, den er en garde. Men en arme er en hær… Hvad mener du, det er..? #dkpol https://t.co/D1k70EJQU2"
92,['1505963280082296834'],1505963280082296834,"Så er EUs hær (nå nej, det må jeg ikke kalde den) en realitet..! Men hvad skal den så bruges til? Og hvad vil eu-partierne egentlig, hvis de får danskerne til at opgive forsvarsforbeholdet..? #dkpol 

https://t.co/PwWQhAaiHf"
93,['1505804680944828417'],1505804680944828417,"Hvorfor var Rockwoll Fonden egentlig ikke på høringslisten ifm. ukrainerloven..? Jeg spurgte, men fik intet svar af @mattiastesfaye #dkpol https://t.co/Ay0AcM8XlJ"
94,['1505802646560464896'],1505802646560464896,"Hvor længe kan eu-partierne lyve om, at EU ikke arbejder på at få sin egen hær? Og hvordan kan man garantere, at dette ikke vil udfordre NATO..? #dkpol https://t.co/da9rtu1CWM"
95,['1505566302437531651'],1505566302437531651,"Vi stiller forslag om, at pengene skal ud NU #dkpol https://t.co/HSM09isd7V"
96,['1505565826434404355'],1505565826434404355,"@cordua_jarl Når man tænker på, hvad du i almindelighed forsøger at bilde befolkningen ind, ville jeg nok passe på med at kalde andres tanker for skøre. Men bortset fra det, er jeg da enig…"
97,['1505564972411203588'],1505564972411203588,slava ukraine 💪💪💪 https://t.co/tChig2PYlT
98,['1505564528322437120'],1505564528322437120,"Der er simpelthen for meget socialistisk usikkerhed i det her… Tror, sf skal vente med at tiltræde forsvarsforliget… https://t.co/DIbEqh2scg"
99,['1505563719232901123'],1505563719232901123,"Det her er selvsagt helt uacceptabelt.  Vi fremsætter forslag, der pålægger regeringen at udbetale pengene inden sommer..!! #Handling #Nu #dkpol https://t.co/F5rDEoPAiN"
